text,Marks,topic,Year,Question_ID,section,,subject
"A satellite in an elliptical orbit around the earth has an apogee of 39,152 km and perigee of 500 km. What is the orbital period of this satellite? Give your answer in hours.",5,Orbital Period Calculation,2024,1508,B,,
"Explain the brief history of satellite systems, advantages, and disadvantages.",5,History of Satellite Systems,2024,1509,B,,
Explain the satellite link equation. What are the factors that affect C/N ratio?,5,Satellite Link Equation,2024,1510,B,,
What are the Orbital Parameters? Explain with diagrams and expressions in detail.,10,Orbital Parameters,2024,1511,C,,
Compare advantages of CDMA over TDMA and FDMA. Explain TDMA frame structure.,10,CDMA vs TDMA vs FDMA,2024,1512,C,,
"Write short notes on the following: 
1) Sun Transit-Outage phenomena, its effects and remedies 
2) Roles of various sub-systems of a satellite system",10,Short Notes,2024,1513,C,,
Define inductive reactance and capacitive reactance.,2,Inductive and Capacitive Reactance,2024,1514,A,,
Differentiate between direct current and alternating current quantities.,2,DC vs AC Quantities,2024,1515,A,,
State the principle of operation of a transformer.,2,Transformer Operation,2024,1516,A,,
Write the Truth Tables for RS and JK flip-flops.,2,RS and JK Flip-Flops,2024,1517,A,,
Define knee voltage and breakdown voltage of a diode.,2,Knee Voltage and Breakdown Voltage,2024,1518,A,,
State Faraday’s Laws.,2,Faraday's Laws,2024,1519,A,,
How can impedance be represented in polar form and rectangular form?,2,Impedance Representation,2024,1520,A,,
"Write the Truth Tables for OR gate, NOR gate & XOR gate.",2,Logic Gates,2024,1521,A,,
Classify various types of transducers.,2,Transducers,2024,1522,A,,
What is the function of a commutator in DC machines?,2,Commutator in DC Machines,2024,1523,A,,
"A series RLC circuit consists of resistance of 2 ohms, a coil of inductive reactance of 4 ohms and a capacitor of capacitive reactance of 3 ohms across a 220V, 50Hz AC supply. Find:
(a) Impedance
(b) RMS value of current
(c) Maximum value of current
(d) Power factor and power of the circuit.",5,Series RLC Circuit,2024,1524,B,,
Explain the working of a D flip-flop with the help of a diagram and truth table.,5,D Flip-Flop,2024,1525,B,,
Illustrate the working of a multimeter.,5,Multimeter,2024,1526,B,,
Elaborate the operation of a full-wave bridge rectifier.,5,Full-Wave Bridge Rectifier,2024,1527,B,,
Explain the construction and working principle of a transformer. Find the expression for emf induced in the transformer.,5,Transformer Principle,2024,1528,B,,
Explain the principle of operation of a DC motor. How are DC motors classified and what are their applications?,10,DC Motor Operation,2024,1529,C,,
Discuss the operation of a BJT amplifier in CE mode.,10,BJT Amplifier in CE Mode,2024,1530,C,,
How are three-phase motors classified? Explain the construction and applications of each type.,10,Three-Phase Motors,2024,1531,C,,
Find current I using nodal and mesh analysis.,10,Nodal and Mesh Analysis,2024,1532,C,,
What is the difference between co-channel and adjacent channel interference?,2,Co-channel and Adjacent Channel Interference,2024,1533,A,,
Explain dynamic channel allocation scheme.,2,Dynamic Channel Allocation,2024,1534,A,,
What is fading effect?,2,Fading Effect,2024,1535,A,,
Write down the factors causing co-channel interference.,2,Factors Causing Co-channel Interference,2024,1536,A,,
"If the cluster size N is reduced while the cell size is kept constant, what is the effect on capacity?",2,Effect of Cluster Size on Capacity,2024,1537,A,,
What is equal gain combining method?,2,Equal Gain Combining,2024,1538,A,,
How much there is an increase in spectrum efficiency offered by 3G compared to 2G?,2,Spectrum Efficiency in 3G vs 2G,2024,1539,A,,
What is guard space?,2,Guard Space,2024,1540,A,,
What do you mean by forward and reverse channel?,2,Forward and Reverse Channel,2024,1541,A,,
What is a base station?,2,Base Station,2024,1542,A,,
Explain the different handover schemes used in wireless communication.,5,Handover Schemes,2024,1543,B,,
Explain in detail cell splitting and cell sectoring.,5,Cell Splitting and Sectoring,2024,1544,B,,
Discuss ALOHA and Slotted ALOHA Protocol.,5,ALOHA and Slotted ALOHA,2024,1545,B,,
Define the concept of frequency channels.,5,Frequency Channels,2024,1546,B,,
Design a half adder.,2,Half Adder,2024,1547,A,,
What is a ring counter?,2,Ring Counter,2024,1548,A,,
What do you mean by a shift register?,2,Shift Register,2024,1549,A,,
Convert a Hexadecimal number (DAC) to an Octal and Binary number system.,2,Hexadecimal to Octal and Binary Conversion,2024,1550,A,,
Convert a Gray code 11001010 to a binary number?,2,Gray Code to Binary Conversion,2024,1551,A,,
Differentiate between a latch and a flip-flop.,2,Latch vs Flip-Flop,2024,1552,A,,
How NOR can be used as NAND?,2,NOR as NAND,2024,1553,A,,
What is a Seven Segment Display?,2,Seven Segment Display,2024,1554,A,,
Convert a JK flip-flop to a D flip-flop.,2,JK to D Flip-Flop,2024,1555,A,,
What is the operating voltage of TTL 7400 IC?,2,TTL 7400 IC Operating Voltage,2024,1556,A,,
Explain the working of a T flip-flop.,5,T Flip-Flop,2024,1557,B,,
Design and explain the working of a 3-bit counter.,5,3-bit Counter,2024,1558,B,,
"Implement the logic function F(A,B,C) = Σ(1,3,5,7) using.",5,Logic Function Implementation,2024,1559,B,,
Discuss De-Morgan’s theorems with some examples.,5,De-Morgan's Theorems,2024,1560,B,,
What is an encoder? Discuss about it.,5,Encoder,2024,1561,B,,
"Simplify the following function as the minimal sum using K-map: F = Σ(1, 2, 4, 5, 13, 14, 15) + Σ(9, 12).",10,K-map Simplification,2024,1562,C,,
What do you mean by a D/A converter? Discuss types of D/A converters.,10,D/A Converter,2024,1563,C,,
Write technical notes on the following: Semiconductor memories and programmable A/D converters.,10,Semiconductor Memories and A/D Converters,2024,1564,C,,
Define the term Electrical safety.,2,Electrical Safety,2024,1565,A,,
What are Electrical Hazards? How is it classified?,2,Electrical Hazards,2024,1566,A,,
What are the risks involved during installation of electrical plant?,2,Risks during Electrical Installation,2024,1567,A,,
What is system grounding?,2,System Grounding,2024,1568,A,,
Mention various types of electrical rotating machines.,2,Electrical Rotating Machines,2024,1569,A,,
What is safety auditing of electrical system?,2,Safety Auditing,2024,1570,A,,
Name the earthing devices used for electrical safety.,2,Earthing Devices,2024,1571,A,,
List out some electrical causes of fire and explosion.,2,Electrical Causes of Fire,2024,1572,A,,
What are primary electrical shocks?,2,Primary Electrical Shocks,2024,1573,A,,
Mention various shocks that occur due to electrical faults.,2,Electrical Fault Shocks,2024,1574,A,,
Explain the installation process of electrical equipment.,5,Installation of Electrical Equipment,2024,1575,B,,
Discuss the risks during the installation of electrical plant.,5,Risks during Installation,2024,1576,B,,
Explain the significance of system grounding in electrical safety.,5,Significance of System Grounding,2024,1577,B,,
Enlist various types of electrical rotating machines used in industrial setups.,5,Types of Electrical Rotating Machines,2024,1578,B,,
Define cells and clusters?,2,Cells and Clusters,2024,1579,A,,
State principle of CDMA?,2,CDMA,2024,1580,A,,
What is the concept of diversity?,2,Diversity,2024,1581,A,,
Define MS and MSC?,2,MS and MSC,2024,1582,A,,
How is higher data rate accomplished in EDGE technology?,2,EDGE Technology,2024,1583,A,,
What is the near-far effect in wireless networks?,2,Near-Far Effect,2024,1584,A,,
What are SIM and IMEI number?,2,SIM and IMEI,2024,1585,A,,
Explain the TDMA frame structure?,2,TDMA Frame Structure,2024,1586,A,,
Define coherence time and coherence BW?,2,Coherence Time and BW,2024,1587,A,,
What is the blocked call delay system?,2,Blocked Call Delay,2024,1588,A,,
Compare the slotted ALOHA and pure ALOHA protocols and calculate the maximum throughput attainable with each protocol.,5,ALOHA Protocols,2024,1589,B,,
Explain the various methods that increase the channel capacity and coverage of the system.,5,Channel Capacity and Coverage,2024,1590,B,,
"Explain FDMA, TDMA, and CDMA multiple access techniques used in communication systems.",5,Multiple Access Techniques,2024,1591,B,,
"Calculate the frame efficiency of a GSM time slots 6 trailing bits, 8.25 guard bits, 26 training bits, and two traffic bursts of 58 bits of data.",5,GSM Frame Efficiency,2024,1592,B,,
Describe channel assignment strategies?,5,Channel Assignment Strategies,2024,1593,B,,
What do you mean by small scale fading and what are the factors influencing small scale fading?,10,Small Scale Fading,2024,1594,C,,
Explain GSM system architecture and its various channel types.,10,GSM System Architecture,2024,1595,C,,
Write a note on RAKE receiver.,10,RAKE Receiver,2024,1596,C,,
Write a note on 5G technology.,10,5G Technology,2024,1597,C,,
What is the function of a capacitor in a capacitor start induction motor?,2,Capacitor Start Induction Motor,2024,1598,A,,
What is meant by slip of an induction motor?,2,Slip of Induction Motor,2024,1599,A,,
What types of losses occur in the rotor of three-phase induction motor?,2,Rotor Losses,2024,1600,A,,
Define Ferraris Principle.,2,Ferraris Principle,2024,1601,A,,
What are the methods of minimizing hunting in synchronous machines?,2,Minimizing Hunting,2024,1602,A,,
Give the applications of reluctance and hysteresis motors.,2,Reluctance and Hysteresis Motors,2024,1603,A,,
"A 4-pole, 50 Hz, 3-phase induction motor is running at a speed of 1400 rpm. Find the value of slip.",2,Slip Calculation,2024,1604,A,,
What are the applications of double cage induction motor?,2,Double Cage Induction Motor,2024,1605,A,,
Why three-phase synchronous motors are not self-starting?,2,Synchronous Motors,2024,1606,A,,
Explain the concept of rotating field in three-phase induction motor and why?,5,Rotating Field,2024,1607,B,,
"A 4-pole, 3-phase squirrel cage induction motor is connected across a 400V, 50 Hz supply. The input power is 10 kW. The stator losses are 150 W. Find the speed of magnetic field, speed of rotor, and rotor copper losses.",5,Induction Motor Losses,2024,1608,B,,
How are single-phase induction motors classified? Give a brief description of each type of motor.,5,Single-Phase Motors,2024,1609,B,,
Derive the equation for field emf for a cylinder rotor three-phase synchronous machine.,5,Synchronous Machine EMF,2024,1610,B,,
Explain V-curves for synchronous machines.,5,V-Curves,2024,1611,B,,
Why starters are required for three-phase induction motors? Explain the types of starters used.,10,Induction Motor Starters,2024,1612,C,,
Derive the equation for field emf for a cylinder rotor three-phase synchronous machine.,10,Synchronous Machine EMF,2024,1613,C,,
Explain the principle of operation of an Induction Generator and its applications.,10,Induction Generator,2024,1614,C,,
Explain the constructional features of a stepper motor.,2,Stepper Motor,2024,1615,A,,
Briefly describe about the Repulsion motor.,2,Repulsion Motor,2024,1616,A,,
What are the key characteristics of switched reluctance motors?,2,Switched Reluctance Motor,2024,1617,A,,
Briefly describe the constructional features of a permanent magnet brushless D.C. motor.,2,Permanent Magnet Brushless D.C. Motor,2024,1618,A,,
State the fundamental principle of permanent magnet synchronous motor.,2,Permanent Magnet Synchronous Motor,2024,1619,A,,
Define cogging.,2,Cogging,2024,1620,A,,
Discuss the applications of permanent magnet brushless D.C. motors.,2,Applications of PM Brushless D.C. Motors,2024,1621,A,,
Define the term 'lead angle'.,2,Lead Angle,2024,1622,A,,
Explain the principle of operation of permanent magnet synchronous motor.,2,Permanent Magnet Synchronous Motor,2024,1623,A,,
Predicting the torque in switched reluctance motors.,5,Torque in Switched Reluctance Motors,2024,1624,B,,
Explain the operation of a hysteresis motor.,5,Hysteresis Motor,2024,1625,B,,
Discuss the analytical methods used for predicting performance in switched reluctance motors.,5,Performance of Switched Reluctance Motors,2024,1626,B,,
Describe the constructional features and working principle of a linear induction motor.,5,Linear Induction Motor,2024,1627,B,,
Provide a brief comparison between the power controller circuits in switched reluctance motors and permanent magnet synchronous motors.,5,Power Controller Circuits,2024,1628,B,,
Analyze the performance of a Repulsion motor.,5,Performance of Repulsion Motor,2024,1629,B,,
Discuss the controllers used in permanent magnet brushless D.C. motors.,5,PM Brushless D.C. Motor Controllers,2024,1630,B,,
Elaborate on the power converter circuit for D.C. motors.,5,Power Converter Circuits for D.C. Motors,2024,1631,B,,
Describe the working and applications of stepper motors in various scenarios.,10,Applications of Stepper Motors,2024,1632,C,,
How are BLDC motors different from ordinary DC motors? Explain how commutation works in BLDC motors.,10,BLDC vs Ordinary DC Motors,2024,1633,C,,
Write a technical note on the following: (a) Constructional features and working principle of a reluctance motor.,10,Reluctance Motor,2024,1634,C,,
List methods used for high current measurement.,2,High Current Measurement,2024,1635,A,,
What is the function of aquadag coating in CRT?,2,Aquadag Coating in CRT,2024,1636,A,,
Compare dynamometer type and induction type wattmeter.,2,Dynamometer vs Induction Wattmeter,2024,1637,A,,
Write the importance of range/extension.,2,Range/Extension,2024,1638,A,,
What is gauge factor?,2,Gauge Factor,2024,1639,A,,
What is an ac potentiometer? List its types.,2,AC Potentiometer,2024,1640,A,,
What is a PMU?,2,PMU,2024,1641,A,,
List different damping torque methods.,2,Damping Torque Methods,2024,1642,A,,
What is the use of Kelvin Double Bridge?,2,Kelvin Double Bridge,2024,1643,A,,
What are clamp on meters?,2,Clamp on Meters,2024,1644,A,,
What is meant by Piezo-resistive transducer? Explain its working principle.,5,Piezo-resistive Transducer,2024,1645,B,,
Derive the equations of balance for Maxwell Inductance Bridge.,5,Maxwell Inductance Bridge,2024,1646,B,,
Explain the working principle of electromagnetic type flowmeter.,5,Electromagnetic Flowmeter,2024,1647,B,,
How do you Standardize a Potentiometer? Explain with a neat diagram.,5,Potentiometer Standardization,2024,1648,B,,
Discuss how the wattmeter can be used for power measurement in a three phase circuit.,5,Wattmeter in Three-Phase Circuit,2024,1649,B,,
Draw the block diagram of an oscilloscope (CRO) and explain the function of each block in detail.,10,Oscilloscope (CRO),2024,1650,C,,
"Explain how frequency, phase, and amplitude of a signal can be measured using a CRO.",10,CRO Signal Measurement,2024,1651,C,,
Explain the principle and operation of current transformer and also the ratio and angle errors.,10,Current Transformer,2024,1652,C,,
Differentiate between current transformer and potential transformer.,10,Current vs Potential Transformer,2024,1653,C,,
"Write notes on any two: (a) Single phase induction type energy meter, (b) Thermistor, (c) Method of high current measurement.",10,"Energy Meter, Thermistor, High Current Measurement",2024,1654,C,,
What is the use of Bluetooth technology?,2,Bluetooth Technology,2024,1655,A,,
What is the use of Sensors & actuators?,2,Sensors & Actuators,2024,1656,A,,
What is the major area of applications of embedded systems?,2,Applications of Embedded Systems,2024,1657,A,,
What do you mean by FPGA?,2,FPGA,2024,1658,A,,
What is the need to use watchdog timer in design?,2,Watchdog Timer,2024,1659,A,,
Differentiate between a microprocessor and a microcontroller.,2,Microprocessor vs Microcontroller,2024,1660,A,,
What is kernel space and user space?,2,Kernel Space and User Space,2024,1661,A,,
Discuss basic parts of an operating system?,2,Operating System Basics,2024,1662,A,,
Discuss classification of embedded systems.,2,Embedded Systems Classification,2024,1663,A,,
What is the purpose of using high-level language in embedded systems?,2,High-Level Language in Embedded Systems,2024,1664,A,,
Differentiate between Harvard Architecture and Von-Neumann Architecture.,5,Harvard vs Von-Neumann,2024,1665,B,,
What do you mean by thermal considerations in embedded system design?,5,Thermal Considerations,2024,1666,B,,
Discuss the embedded system design process with the help of a flowchart.,5,Embedded System Design Process,2024,1667,B,,
Discuss various sub-system interfacing available in embedded system design.,5,Subsystem Interfacing,2024,1668,B,,
What are the challenges and design issues in embedded systems? Discuss in detail with suitable justification.,10,Embedded Systems Challenges,2024,1669,C,,
What do you mean by embedded microcontroller cores? Discuss various embedded microcontroller cores available for embedded system design.,10,Embedded Microcontroller Cores,2024,1670,C,,
"Write technical notes on the following: 
1) MESI protocol
2) Asynchronous data transfer
3) Priority interrupt",10,Technical Notes,2024,1671,C,,
Why different frequencies are required for 'Go' and downlink in satellite communication?,2,Frequencies in Satellite Communication,2024,1672,A,,
Why is sidereal day different from a solar day?,2,Sidereal vs Solar Day,2024,1673,A,,
What is footprint in satellite communication? What does it depend upon?,2,Footprint in Satellite Communication,2024,1674,A,,
What is meant by Julian zero time reference?,2,Julian Zero Time Reference,2024,1675,A,,
Write the objectives with which the downlink of any satellite communication system must be designed.,2,Satellite Downlink Objectives,2024,1676,A,,
What are the main functions of Attitude and Orbit Control System?,2,Attitude and Orbit Control System,2024,1677,A,,
A satellite downlink at 12 GHz operates with a transmit power of 6 W and an antenna gain of 48.2 dB. Calculate the EIRP in dBW.,2,EIRP Calculation,2024,1678,A,,
Why is guard time used in TDMA frames?,2,Guard Time in TDMA,2024,1679,A,,
What is eclipse of the satellite?,2,Satellite Eclipse,2024,1680,A,,
What is the impact of atmospheric drag on satellite systems?,2,Atmospheric Drag Impact,2024,1681,A,,
How does the system noise temperature affect the performance? Derive the expression for overall system noise temperature at the receiving earth station.,5,System Noise Temperature,2024,1682,B,,
State Kepler’s three laws of planetary motion and describe the orbit of a satellite with respect to the earth.,5,Kepler's Laws,2024,1683,B,,
"A satellite in an elliptical orbit around the earth has an apogee of 39,152 km and perigee of 500 km. What is the orbital period of this satellite? Give your answer in hours.",5,Orbital Period Calculation,2024,1684,B,,
"Explain the brief history of satellite systems, advantages, and disadvantages.",5,History of Satellite Systems,2024,1685,B,,
Explain the satellite link equation. What are the factors that affect C/N ratio?,5,Satellite Link Equation,2024,1686,B,,
What are the Orbital Parameters? Explain with diagrams and expressions in detail.,10,Orbital Parameters,2024,1687,C,,
Compare advantages of CDMA over TDMA and FDMA. Explain TDMA frame structure.,10,CDMA vs TDMA vs FDMA,2024,1688,C,,
"Write short notes on the following: 
1) Sun Transit-Outage phenomena, its effects and remedies 
2) Roles of various sub-systems of a satellite system",10,Short Notes,2024,1689,C,,
Define inductive reactance and capacitive reactance.,2,Inductive and Capacitive Reactance,2024,1690,A,,
Differentiate between direct current and alternating current quantities.,2,DC vs AC Quantities,2024,1691,A,,
State the principle of operation of a transformer.,2,Transformer Operation,2024,1692,A,,
Write the Truth Tables for RS and JK flip-flops.,2,RS and JK Flip-Flops,2024,1693,A,,
Define knee voltage and breakdown voltage of a diode.,2,Knee Voltage and Breakdown Voltage,2024,1694,A,,
State Faraday’s Laws.,2,Faraday's Laws,2024,1695,A,,
How can impedance be represented in polar form and rectangular form?,2,Impedance Representation,2024,1696,A,,
"Write the Truth Tables for OR gate, NOR gate & XOR gate.",2,Logic Gates,2024,1697,A,,
Classify various types of transducers.,2,Transducers,2024,1698,A,,
What is the function of a commutator in DC machines?,2,Commutator in DC Machines,2024,1699,A,,
"A series RLC circuit consists of resistance of 2 ohms, a coil of inductive reactance of 4 ohms and a capacitor of capacitive reactance of 3 ohms across a 220V, 50Hz AC supply. Find:
(a) Impedance
(b) RMS value of current
(c) Maximum value of current
(d) Power factor and power of the circuit.",5,Series RLC Circuit,2024,1700,B,,
Explain the working of a D flip-flop with the help of a diagram and truth table.,5,D Flip-Flop,2024,1701,B,,
Illustrate the working of a multimeter.,5,Multimeter,2024,1702,B,,
Elaborate the operation of a full-wave bridge rectifier.,5,Full-Wave Bridge Rectifier,2024,1703,B,,
Explain the construction and working principle of a transformer. Find the expression for emf induced in the transformer.,5,Transformer Principle,2024,1704,B,,
Explain the principle of operation of a DC motor. How are DC motors classified and what are their applications?,10,DC Motor Operation,2024,1705,C,,
Discuss the operation of a BJT amplifier in CE mode.,10,BJT Amplifier in CE Mode,2024,1706,C,,
How are three-phase motors classified? Explain the construction and applications of each type.,10,Three-Phase Motors,2024,1707,C,,
Find current I using nodal and mesh analysis.,10,Nodal and Mesh Analysis,2024,1708,C,,
What is the difference between co-channel and adjacent channel interference?,2,Co-channel and Adjacent Channel Interference,2024,1709,A,,
Explain dynamic channel allocation scheme.,2,Dynamic Channel Allocation,2024,1710,A,,
What is fading effect?,2,Fading Effect,2024,1711,A,,
Write down the factors causing co-channel interference.,2,Factors Causing Co-channel Interference,2024,1712,A,,
"If the cluster size N is reduced while the cell size is kept constant, what is the effect on capacity?",2,Effect of Cluster Size on Capacity,2024,1713,A,,
What is equal gain combining method?,2,Equal Gain Combining,2024,1714,A,,
How much there is an increase in spectrum efficiency offered by 3G compared to 2G?,2,Spectrum Efficiency in 3G vs 2G,2024,1715,A,,
What is guard space?,2,Guard Space,2024,1716,A,,
What do you mean by forward and reverse channel?,2,Forward and Reverse Channel,2024,1717,A,,
What is a base station?,2,Base Station,2024,1718,A,,
Explain the different handover schemes used in wireless communication.,5,Handover Schemes,2024,1719,B,,
Explain in detail cell splitting and cell sectoring.,5,Cell Splitting and Sectoring,2024,1720,B,,
Discuss ALOHA and Slotted ALOHA Protocol.,5,ALOHA and Slotted ALOHA,2024,1721,B,,
Define the concept of frequency channels.,5,Frequency Channels,2024,1722,B,,
Design a half adder.,2,Half Adder,2024,1723,A,,
What is a ring counter?,2,Ring Counter,2024,1724,A,,
What do you mean by a shift register?,2,Shift Register,2024,1725,A,,
Convert a Hexadecimal number (DAC) to an Octal and Binary number system.,2,Hexadecimal to Octal and Binary Conversion,2024,1726,A,,
Convert a Gray code 11001010 to a binary number?,2,Gray Code to Binary Conversion,2024,1727,A,,
Differentiate between a latch and a flip-flop.,2,Latch vs Flip-Flop,2024,1728,A,,
How NOR can be used as NAND?,2,NOR as NAND,2024,1729,A,,
What is a Seven Segment Display?,2,Seven Segment Display,2024,1730,A,,
Convert a JK flip-flop to a D flip-flop.,2,JK to D Flip-Flop,2024,1731,A,,
What is the operating voltage of TTL 7400 IC?,2,TTL 7400 IC Operating Voltage,2024,1732,A,,
Explain the working of a T flip-flop.,5,T Flip-Flop,2024,1733,B,,
Design and explain the working of a 3-bit counter.,5,3-bit Counter,2024,1734,B,,
"Implement the logic function F(A,B,C) = Σ(1,3,5,7) using.",5,Logic Function Implementation,2024,1735,B,,
Discuss De-Morgan’s theorems with some examples.,5,De-Morgan's Theorems,2024,1736,B,,
What is an encoder? Discuss about it.,5,Encoder,2024,1737,B,,
"Simplify the following function as the minimal sum using K-map: F = Σ(1, 2, 4, 5, 13, 14, 15) + Σ(9, 12).",10,K-map Simplification,2024,1738,C,,
What do you mean by a D/A converter? Discuss types of D/A converters.,10,D/A Converter,2024,1739,C,,
Write technical notes on the following: Semiconductor memories and programmable A/D converters.,10,Semiconductor Memories and A/D Converters,2024,1740,C,,
Define the term Electrical safety.,2,Electrical Safety,2024,1741,A,,
What are Electrical Hazards? How is it classified?,2,Electrical Hazards,2024,1742,A,,
What are the risks involved during installation of electrical plant?,2,Risks during Electrical Installation,2024,1743,A,,
What is system grounding?,2,System Grounding,2024,1744,A,,
Mention various types of electrical rotating machines.,2,Electrical Rotating Machines,2024,1745,A,,
What is safety auditing of electrical system?,2,Safety Auditing,2024,1746,A,,
Name the earthing devices used for electrical safety.,2,Earthing Devices,2024,1747,A,,
List out some electrical causes of fire and explosion.,2,Electrical Causes of Fire,2024,1748,A,,
What are primary electrical shocks?,2,Primary Electrical Shocks,2024,1749,A,,
Mention various shocks that occur due to electrical faults.,2,Electrical Fault Shocks,2024,1750,A,,
Explain the installation process of electrical equipment.,5,Installation of Electrical Equipment,2024,1751,B,,
Discuss the risks during the installation of electrical plant.,5,Risks during Installation,2024,1752,B,,
Explain the significance of system grounding in electrical safety.,5,Significance of System Grounding,2024,1753,B,,
