text,Marks,topic,Year,Question_ID,section,,subject
How is HTTP related to WWW?,2,Computer Network,2024,1,,,
What are the three FTP transmission modes?,2,Computer Network,2024,2,,,
What is the role of address field in a packet travelling through a virtual circuit network?,2,Computer Network,2024,3,,,
List various broadcast routing methods.,2,Computer Network,2024,4,,,
List the important features of LAN.,2,Computer Network,2024,5,,,
How is a repeater different from an amplifier?,2,Computer Network,2024,6,,,
What is flooding? What are its disadvantages?,2,Computer Network,2024,7,,,
Differentiate between Wired and Wireless Networks.,2,Computer Network,2024,8,,,
What is the purpose of application layer?,2,Computer Network,2024,9,,,
Explain in brief Peer-to-Peer file sharing.,2,Computer Network,2024,10,,,
What is pure ALOHA and slotted ALOHA? Consider the delay of both at low load. Which one is less? Explain your answer.,5,Computer Network,2024,11,,,
Discuss Domain Name System.,5,Computer Network,2024,12,,,
Explain briefly the operation of Hubs and switches.,5,Computer Network,2024,13,,,
Define Protocol. What is the need of Protocol?,5,Computer Network,2024,14,,,
Differentiate between connection-oriented and connectionless services.,5,Computer Network,2024,15,,,
"Explain and differentiate Circuit Switching, Time-division switching, and Space-division switching.",10,Computer Network,2024,16,,,
Explain in detail the basic network topologies and all the relevant features.,10,Computer Network,2024,17,,,
Write notes on PCH model and switch.,10,Computer Network,2024,18,,,
What are the salient features of steam turbines?,2,Electric Power Generation,2024,19,,,
List the advantages of Solar Energy.,2,Electric Power Generation,2024,20,,,
What is the effect of load on power plant design?,2,Electric Power Generation,2024,21,,,
What are the operating characteristics of power plants?,2,Electric Power Generation,2024,22,,,
List the components used in Nuclear power plant.,2,Electric Power Generation,2024,23,,,
What is meant by Economic Scheduling?,2,Electric Power Generation,2024,24,,,
Differentiate between gas turbine and steam power plants.,2,Electric Power Generation,2024,25,,,
What are the economic aspects of Geothermal power plants?,2,Electric Power Generation,2024,26,,,
What are small scale hydroelectric plants?,2,Electric Power Generation,2024,27,,,
Define electric tariffs and peak load pricing.,2,Electric Power Generation,2024,28,,,
Describe the components of Gas turbine power plants.,5,Electric Power Generation,2024,29,,,
Explain the working of steam and hydraulic turbines and speed governors.,5,Electric Power Generation,2024,30,,,
What are Nuclear reactors? Briefly describe different types of Nuclear reactors.,5,Electric Power Generation,2024,31,,,
Describe in brief the different types of fuel cells with the help of diagrams.,5,Electric Power Generation,2024,32,,,
Explain the working of thermal power plants. Also explain its economic aspects.,5,Electric Power Generation,2024,33,,,
Explain the construction and working of Magneto-Hydro Dynamic (MHD) with a diagram.,10,Electric Power Generation,2024,34,,,
Explain in detail the principle types of Power Plants along with their specific applications.,10,Electric Power Generation,2024,35,,,
What is meant by cogeneration? Explain in detail how the allocation of electricity impacts cogeneration.,10,Electric Power Generation,2024,36,,,
Differentiate between microprocessor and Microcontroller.,2,Microprocessor & Microcontroller,2024,37,,,
Name the various Instructions set of 8085.,2,Microprocessor & Microcontroller,2024,38,,,
What is the maximum clock frequency of the 8051 microcontroller?,2,Microprocessor & Microcontroller,2024,39,,,
List out the Single bit Instructions in 8051.,2,Microprocessor & Microcontroller,2024,40,,,
What do you mean by data types and directives in 8051?,2,Microprocessor & Microcontroller,2024,41,,,
"How many flags are there in the Flag Register of the 8085 microprocessor, and what are their meanings?",2,Microprocessor & Microcontroller,2024,42,,,
List few applications of Microprocessor based systems.,2,Microprocessor & Microcontroller,2024,43,,,
Write an 8051-assembly program to add two 8-bit numbers.,2,Microprocessor & Microcontroller,2024,44,,,
"Explain LDA, STA instruction of 8085.",2,Microprocessor & Microcontroller,2024,45,,,
What is the function of ALE and EA/VPP pins in 8051?,2,Microprocessor & Microcontroller,2024,46,,,
List out five categories of 8085 instructions. Give example of each group.,5,Microprocessor & Microcontroller,2024,47,,,
Discuss the role of register banks and stack in 8051.,5,Microprocessor & Microcontroller,2024,48,,,
Explain memory-mapped I/O addressing scheme.,5,Microprocessor & Microcontroller,2024,49,,,
How is serial communication established between an 8051 microcontroller and an RS-232 interface?,5,Microprocessor & Microcontroller,2024,50,,,
Explain the functional pin diagram of 8051 Microcontroller.,5,Microprocessor & Microcontroller,2024,51,,,
Describe the Architecture of 8085 microprocessor in detail.,10,Microprocessor & Microcontroller,2024,52,,,
How does the interrupt structure of the 8051 microcontroller work? Explain prioritizing interrupts within it.,10,Microprocessor & Microcontroller,2024,53,,,
"Write a short note on any two: a) Interfacing of 8051 with LCD, b) Embedded Processors.",10,Microprocessor & Microcontroller,2024,54,,,
State the significance of Smith chart and its features.,2,Electromagnetic Waves,2024,55,,,
What is field visualization?,2,Electromagnetic Waves,2024,56,,,
State the properties of uniform plane wave.,2,Electromagnetic Waves,2024,57,,,
What is the difference between group velocity and phase velocity?,2,Electromagnetic Waves,2024,58,,,
Define propagation constant.,2,Electromagnetic Waves,2024,59,,,
What is meant by characteristic impedance of transmission line?,2,Electromagnetic Waves,2024,60,,,
What is difference between dipole and monopole antenna?,2,Electromagnetic Waves,2024,61,,,
What is radiation resistance of Hertz dipole antenna?,2,Electromagnetic Waves,2024,62,,,
What is impedance matching?,2,Electromagnetic Waves,2024,63,,,
What is waveguide and its importance?,2,Electromagnetic Waves,2024,64,,,
Explain wave polarization at media interface.,5,Electromagnetic Waves,2024,65,,,
Obtain an expression for the power loss in the plane conductor in terms of surface impedance.,5,Electromagnetic Waves,2024,66,,,
Derive the equations of voltage and current on Transmission line.,5,Electromagnetic Waves,2024,67,,,
Explain the radiation parameters of antenna.,5,Electromagnetic Waves,2024,68,,,
Explain impedance transformation on Lossless and Low loss Transmission line.,5,Electromagnetic Waves,2024,69,,,
Derive Maxwell's Field equations and explain their significance.,10,Electromagnetic Waves,2024,70,,,
Explain reflection and refraction at dielectric interface.,10,Electromagnetic Waves,2024,71,,,
Explain in detail modal propagation in rectangular waveguide.,10,Electromagnetic Waves,2024,72,,,
What is a spectrum analyzer?,2,Electronics Measurement,2024,73,A,,
Compare LED with LCD.,2,Electronics Measurement,2024,74,A,,
Write the importance of range extension.,2,Electronics Measurement,2024,75,A,,
What are the important factors to be considered for selecting a transducer?,2,Electronics Measurement,2024,76,A,,
Explain how frequency can be measured by a CRO using the Lissajous pattern.,2,Electronics Measurement,2024,77,A,,
Discuss various compensation networks required for thermocouples.,2,Electronics Measurement,2024,78,A,,
Define a Wave Analyzer and list its types.,2,Electronics Measurement,2024,79,A,,
What is gauge factor? Give the gauge factor of a material.,2,Electronics Measurement,2024,80,A,,
What is loading effect?,2,Electronics Measurement,2024,81,A,,
List different types of errors that occur in measurements.,2,Electronics Measurement,2024,82,A,,
"With the help of a neat diagram, explain the working of a ramp-type digital voltmeter.",5,Electronics Measurement,2024,83,B,,
"Define the terms: resolution, sensitivity, accuracy, precision & errors.",5,Electronics Measurement,2024,84,B,,
Discuss the working of strip chart recorders.,5,Electronics Measurement,2024,85,B,,
Draw the block diagram of a function generator and explain its operation.,5,Electronics Measurement,2024,86,B,,
Calculate the change in length of the beam and the amount of force applied to the beam given specific parameters of a strain gauge.,5,Electronics Measurement,2024,87,B,,
(a) Explain the construction and working of PMMC type instruments. (b) Describe the operation of the Wheatstone bridge and derive the expression for DC resistance.,10,Electronics Measurement,2024,88,C,,
(a) Describe the working principle of a piezoelectric transducer. List its various advantages and disadvantages. (b) Discuss the working of a photoconductive cell.,10,Electronics Measurement,2024,89,C,,
"Write notes on any two: Telemetry, Cathode Ray Tube, Harmonic distortion analyzer.",10,Electronics Measurement,2024,90,C,,
Define directivity of a directional coupler.,2,Microwave Theory,2024,91,A,,
Differentiate tunnel diode from ordinary PN diode.,2,Microwave Theory,2024,92,A,,
"If a line with Z0 = 300 Ω is open circuited at the far end, what is the VSWR?",2,Microwave Theory,2024,93,A,,
Discuss the features of TEM modes.,2,Microwave Theory,2024,94,A,,
Define coupling factor.,2,Microwave Theory,2024,95,A,,
What is the need for impedance matching?,2,Microwave Theory,2024,96,A,,
Name the different frequency bands used in microwave engineering and their frequency spectra.,2,Microwave Theory,2024,97,A,,
Determine the cut-off frequency and cut-off wavelength for the TM11 mode in an air-filled waveguide with given dimensions.,2,Microwave Theory,2024,98,A,,
Why is the magnetron called a cross-field device?,2,Microwave Theory,2024,99,A,,
List the limitations of conventional microwave tubes.,2,Microwave Theory,2024,100,A,,
Explain the working of a Gunn diode and discuss its characteristics.,5,Microwave Theory,2024,101,B,,
Calculate the value of the reflected power given specific parameters of directional couplers and VSWR.,5,Microwave Theory,2024,102,B,,
Explain the properties of H-plane Tee and why it is called shunt Tee.,5,Microwave Theory,2024,103,B,,
Explain the working of an RFID system.,5,Microwave Theory,2024,104,B,,
Discuss the structure and principle of operation of an isolator and circulator.,5,Microwave Theory,2024,105,B,,
"(a) Discuss the properties of S-parameters for lossless and reciprocal networks. (b) Given S parameters, find symmetry, reciprocity, and insertion loss.",10,Microwave Theory,2024,106,C,,
"Explain the construction, working, and applications of a Klystron.",10,Microwave Theory,2024,107,C,,
(a) Discuss noise at microwave frequencies and how it is measured. (b) Write a note on microwave imaging.,10,Microwave Theory,2024,108,C,,
What is VSB (Vestigial side band)?,2,Analog Communication,2024,109,A,,
What is Zero crossing detector?,2,Analog Communication,2024,110,A,,
What do you understand by mixing?,2,Analog Communication,2024,111,A,,
What is image rejection ratio?,2,Analog Communication,2024,112,A,,
What is the need for modulation?,2,Analog Communication,2024,113,A,,
Write basic differences between low-level and high-level modulation.,2,Analog Communication,2024,114,A,,
Define Modulation Index of FM & AM waves.,2,Analog Communication,2024,115,A,,
Explain selectivity in AM receiver.,2,Analog Communication,2024,116,A,,
What are the advantages of using high-frequency carrier for transmission?,2,Analog Communication,2024,117,A,,
What is pre-emphasis and de-emphasis?,2,Analog Communication,2024,118,A,,
Explain phase shift method of SSB generation.,5,Analog Communication,2024,119,B,,
What is Pulse width modulation? How are PWM and PPM correlated?,5,Analog Communication,2024,120,B,,
What is amplitude modulation? Derive expression for amplitude modulated signal.,5,Analog Communication,2024,121,B,,
Explain the working of a balanced slope detector. What are its limitations?,5,Analog Communication,2024,122,B,,
Explain the operation of a square law detector.,5,Analog Communication,2024,123,B,,
Discuss the receiver parameters of an amplitude receiver in detail.,10,Analog Communication,2024,124,C,,
State the sampling theorem and discuss different types of sampling. Explain the reconstruction of the original signal.,10,Analog Communication,2024,125,C,,
"Write short notes on any two: PLL (Phase Lock Loop), Armstrong method for generation of FM, TDM (Time Division Multiplexing).",10,Analog Communication,2024,126,C,,
Explain engineering economics?,2,Economics,2024,127,A,,
Differentiate microeconomics and macroeconomics.,2,Economics,2024,128,A,,
Explain factors affecting supply?,2,Economics,2024,129,A,,
Define marginal cost?,2,Economics,2024,130,A,,
What is economic efficiency?,2,Economics,2024,131,A,,
Explain inflation.,2,Economics,2024,132,A,,
Explain the concept of demand?,2,Economics,2024,133,A,,
Write conditions for perfect competition?,2,Economics,2024,134,A,,
Describe marginal revenue.,2,Economics,2024,135,A,,
Explain features of monopolistic competition.,2,Economics,2024,136,A,,
How is engineering economics different from economics?,5,Economics,2024,137,B,,
Explain the concept of break-even analysis with a clear diagram.,5,Economics,2024,138,B,,
Write a detailed note on demand and supply equilibrium with a diagram.,5,Economics,2024,139,B,,
Explain how price determination is done under perfect competition.,5,Economics,2024,140,B,,
Explain briefly various factors affecting elasticity of demand.,5,Economics,2024,141,B,,
How does cost affect the economy? Explain the concept of fixed cost and variable cost.,10,Economics,2024,142,C,,
Explain the nature and scope of business economics.,10,Economics,2024,143,C,,
Explain the meaning and features of oligopoly and identify its characteristics.,10,Economics,2024,144,C,,
What are the characteristics of a dual op-amp?,2,Analog Circuits,2024,145,A,,
Define CMRR.,2,Analog Circuits,2024,146,A,,
What are the requirements for oscillators?,2,Analog Circuits,2024,147,A,,
Find the output when 5 V is applied at the non-inverting input of 741 in open-loop configuration.,2,Analog Circuits,2024,148,A,,
Why are coupling capacitors used?,2,Analog Circuits,2024,149,A,,
Give the operating principle of a Wien bridge oscillator.,2,Analog Circuits,2024,150,A,,
What is meant by balanced and unbalanced output in a differential amplifier?,2,Analog Circuits,2024,151,A,,
Why do amplifiers use negative feedback?,2,Analog Circuits,2024,152,A,,
Discuss the application of a diode as a clipper circuit.,2,Analog Circuits,2024,153,A,,
What are the advantages of flash type ADC?,2,Analog Circuits,2024,154,A,,
Discuss the working of a half-wave rectifier.,5,Analog Circuits,2024,155,B,,
Explain the working of a sanity filter and determine thresholds.,5,Analog Circuits,2024,156,B,,
Draw the circuit diagram for Class A SS and explain its working.,5,Analog Circuits,2024,157,B,,
Calculate the gain of an inverting amplifier with feedback and draw input/output waveforms.,5,Analog Circuits,2024,158,B,,
Discuss the working of a current mirror circuit.,5,Analog Circuits,2024,159,B,,
(a) Explain the working of dual slope ADC. (b) Determine voltage gain and input resistance under given conditions.,10,Analog Circuits,2024,160,C,,
(a) Design a low pass filter with a specified cut-off frequency. (b) Discuss the working of a phase shift oscillator.,10,Analog Circuits,2024,161,C,,
Discuss gain and phase margins. How does feedback affect gain and input resistance?,10,Analog Circuits,2024,162,C,,
"A 100 Ω strain gauge with a gauge factor of 1 is affixed to a metal bar. The bar is stretched, causing a change in resistance of 0.001 Ω. Find the change in length if the original length is 10 cm.",2,Electronics Measurement,2024,163,A,,
What is systematic error? List its types.,2,Electronics Measurement,2024,164,A,,
Compare landline and RF telemetry.,2,Electronics Measurement,2024,165,A,,
What is a spectrum analyzer?,2,Electronics Measurement,2024,166,A,,
What is the working principle of a photovoltaic cell?,2,Electronics Measurement,2024,167,A,,
Compare LED with LCD.,2,Electronics Measurement,2024,168,A,,
Compare analog voltmeter with digital voltmeter.,2,Electronics Measurement,2024,169,A,,
Why and which compensation circuits are used with thermocouples?,2,Electronics Measurement,2024,170,A,,
What is sensitivity?,2,Electronics Measurement,2024,171,A,,
Write the importance of range extension.,2,Electronics Measurement,2024,172,A,,
Explain the working of a ramp-type digital voltmeter.,5,Electronics Measurement,2024,173,B,,
Discuss the working principle of LVDT (Linear Variable Differential Transformer).,5,Electronics Measurement,2024,174,B,,
"Discuss accuracy, precision, linearity, and loading effect briefly.",5,Electronics Measurement,2024,175,B,,
Discuss the working of a function generator with a block diagram.,5,Electronics Measurement,2024,176,B,,
Derive the balance equation for Schering bridges.,5,Electronics Measurement,2024,177,B,,
Explain the working of a CRO (Cathode Ray Oscilloscope) in detail. How can frequency and phase be measured?,10,Electronics Measurement,2024,178,C,,
(a) Discuss the working principle of attraction in moving iron. (b) Explain the working of a harmonic distortion analyzer.,10,Electronics Measurement,2024,179,C,,
"Write notes on any two: Strain gauge, Magnetic Tape Recorders, Telemetry.",10,Electronics Measurement,2024,180,C,,
Show that the TMo mode in a rectangular waveguide does not exist.,2,Electromagnetic Waves,2024,181,A,,
What is the relation between aperture and gain of antenna?,2,Electromagnetic Waves,2024,182,A,,
What are the boundary conditions at media interface?,2,Electromagnetic Waves,2024,183,A,,
"EM waves are called guided waves? True or false, justify your answer.",2,Electromagnetic Waves,2024,184,A,,
The attenuation constant is 0.5 units. Then calculate skin depth.,2,Electromagnetic Waves,2024,185,A,,
What is meant by characteristic impedance of transmission line?,2,Electromagnetic Waves,2024,186,A,,
Calculate the radiation resistance of an antenna which is drawing 15 amp current and radiating power.,2,Electromagnetic Waves,2024,187,A,,
What is Brewster reflection?,2,Electromagnetic Waves,2024,188,A,,
Define the dominant and degenerate modes with examples.,2,Electromagnetic Waves,2024,189,A,,
What is phase velocity in free space and dielectric medium with loss?,2,Electromagnetic Waves,2024,190,A,,
Write and explain Maxwell’s equation for static fields.,5,Electromagnetic Waves,2024,191,B,,
"A lossless transmission line of characteristic impedance 60 ohms is connected to a load. If the standing wave ratio on the line is 4, calculate the load impedance.",5,Electromagnetic Waves,2024,192,B,,
"What are TE, TM and TEM mode waves? Derive an expression for the TE mode propagating in a hollow rectangular waveguide.",5,Electromagnetic Waves,2024,193,B,,
Explain the basic laws of electromagnetic waves.,5,Electromagnetic Waves,2024,194,B,,
"Given A=x^2y + (x-y)k, B=zx, find Curl A, Div B and explain the physical significance of Curl and Divergence.",5,Electromagnetic Waves,2024,195,B,,
"For reflection by a perfect insulator with oblique incidence, derive the strength to incidental field strength ratio for vertical polarization.",10,Electromagnetic Waves,2024,196,C,,
What are the fundamental parameters of impedance and reflection coefficient?,10,Electromagnetic Waves,2024,197,C,,
What is meant by the term modulation?,2,Analog Communication,2024,198,A,,
What is the advantage of vestigial side band over SSB?,2,Analog Communication,2024,199,A,,
What is double spotting?,2,Analog Communication,2024,200,A,,
Define pre-emphasis and de-emphasis.,2,Analog Communication,2024,201,A,,
What do you mean by image rejection ratio?,2,Analog Communication,2024,202,A,,
Why is the local oscillator frequency always higher than the signal frequency?,2,Analog Communication,2024,203,A,,
What is the function of AGC in AM receivers?,2,Analog Communication,2024,204,A,,
Which is more immune to noise: AM or FM and why?,2,Analog Communication,2024,205,A,,
Explain how a constant intermediate frequency is achieved in super heterodyne receivers.,2,Analog Communication,2024,206,A,,
State the sampling theorem.,2,Analog Communication,2024,207,A,,
Explain Ring modulator.,5,Analog Communication,2024,208,B,,
Discuss basic elements of AM super heterodyne receivers.,5,Analog Communication,2024,209,B,,
Describe Foster Seeley discriminator.,5,Analog Communication,2024,210,B,,
Draw and explain the block diagram of a typical AM transmitter.,5,Analog Communication,2024,211,B,,
Discuss Pulse Position Modulation and its applications.,5,Analog Communication,2024,212,B,,
What is noise? Discuss various types of noise and their characteristics.,10,Analog Communication,2024,213,C,,
Discuss the third method of SSB generation/suppression and its various advantages and disadvantages.,10,Analog Communication,2024,214,C,,
"Write short notes on:
(a) AM
(b) Time Division Multiplexing.",10,Analog Communication,2024,215,C,,
What are different types of classes in IPv4 addressing?,2,Computer Networks,2024,216,A,,
What do you understand by Physical and Logical Addressing?,2,Computer Networks,2024,217,A,,
Write the difference between Hub and Switch.,2,Computer Networks,2024,218,A,,
What are the responsibilities of the Transport Layer?,2,Computer Networks,2024,219,A,,
What are its disadvantages?,2,Computer Networks,2024,220,A,,
Compare virtual Circuits and datagrams.,2,Computer Networks,2024,221,A,,
What are the functions of MAC?,2,Computer Networks,2024,222,A,,
What is flooding?,2,Computer Networks,2024,223,A,,
Discuss the use of Broadcast and Multicast routing.,2,Computer Networks,2024,224,A,,
Illustrate the shortest path routing algorithm with a suitable example.,5,Computer Networks,2024,225,B,,
What is ALOHA? Explain its types.,5,Computer Networks,2024,226,B,,
What is meant by TCP? Give an overview of the different protocols used to transfer a file.,5,Computer Networks,2024,227,B,,
Identify the layers in OSI model and their functions.,5,Computer Networks,2024,228,B,,
Give the format of TCP header and explain how a connection is established.,5,Computer Networks,2024,229,B,,
"Write notes on any two:
(a) Hub
(b) Resource Allocation in Packet Switching.",10,Computer Networks,2024,230,C,,
identify the layers in OSI Refrence model and illustrate their function .,10,Computer Networks,2024,231,C,,
Give format of TCP header and discuss the relevance of various field .how transport layer connection is established in TCP? illustrate with state diagram.,10,Computer Networks,2024,232,C,,
"What is the use of MOV B,M in 8085?",2,Microprocessors & Microcontrollers,2024,233,A,,
What is the dual role of Port 2 in 8051?,2,Microprocessors & Microcontrollers,2024,234,A,,
Differentiate between MOVC and MOVX instruction of 8051.,2,Microprocessors & Microcontrollers,2024,235,A,,
What is the use of timer/counter in 8051?,2,Microprocessors & Microcontrollers,2024,236,A,,
Name and explain any two single bit instructions of 8051.,2,Microprocessors & Microcontrollers,2024,237,A,,
Which port of 8051 is dedicated to be used for I/O operations only?,2,Microprocessors & Microcontrollers,2024,238,A,,
What is the use of an ADC?,2,Microprocessors & Microcontrollers,2024,239,A,,
Differentiate between a microprocessor and microcontroller.,2,Microprocessors & Microcontrollers,2024,240,A,,
Name two arithmetic instructions of 8051.,2,Microprocessors & Microcontrollers,2024,241,A,,
What is the use of DPTR in 8051?,2,Microprocessors & Microcontrollers,2024,242,A,,
What do you mean by an interrupt? Discuss the interrupt structure of 8085.,5,Microprocessors & Microcontrollers,2024,243,B,,
What is PSW of 8051? Discuss its use with suitable examples.,5,Microprocessors & Microcontrollers,2024,244,B,,
What do you mean by an addressing mode? Discuss addressing modes of 8051 with examples.,5,Microprocessors & Microcontrollers,2024,245,B,,
"Write an assembly language program to sort a series of ten bytes in ascending order, starting from 3070h onwards.",5,Microprocessors & Microcontrollers,2024,246,B,,
What is the need for demultiplexing? Explain address-data demultiplexing of 8085 with a suitable diagram.,5,Microprocessors & Microcontrollers,2024,247,B,,
Discuss the architecture of 8085 with a suitable block diagram. Discuss the use of each part.,10,Microprocessors & Microcontrollers,2024,248,C,,
Discuss the interfacing of the 2x16 LCD with 8051 with the help of a circuit diagram.,10,Microprocessors & Microcontrollers,2024,249,C,,
Write a program to display 'HELLO' on the first line of the LCD.,10,Microprocessors & Microcontrollers,2024,250,C,,
Write a technical note on the following: a) Interfacing of DAC with 8051 b) Flags of 8085.,10,Microprocessors & Microcontrollers,2024,251,C,,
Compare the microstrip antenna and conventional pole antenna.,2,Antenna and Propagation,2024,252,A,,
What do you understand by retarded current?,2,Antenna and Propagation,2024,253,A,,
What is Babinet’s principle?,2,Antenna and Propagation,2024,254,A,,
At what distance from the dipole is the induction field equal to the radiation field?,2,Antenna and Propagation,2024,255,A,,
Calculate the radiation resistance of an antenna which is drawing 15 amp current and radiating power of KW.,2,Antenna and Propagation,2024,256,A,,
How is Huygens’ principle applied on antennas?,2,Antenna and Propagation,2024,257,A,,
Define folded dipole. Compare the Zin of folded dipole with conventional dipole.,2,Antenna and Propagation,2024,258,A,,
