text,Marks,topic,Year,Question_ID,section,,subject
What is a debugger in system programming?,20,,2024,4578,A,,System Programming
"Discuss different types of intermediate forms used by compiler, with examples.",5,,2024,4579,B,,System Programming
What is dynamic linking? How does dynamic loader help in implementing dynamic linking?,5,,2024,4580,B,,System Programming
Discuss in detail the first pass of assembler with its algorithms.,5,,2024,4581,B,,System Programming
Differentiate between Macro and Subroutine with a suitable example.,5,,2024,4582,B,,System Programming
Describe the various debugging techniques.,5,,2024,4583,B,,System Programming
What are the features of system programming? Compare it with application programming.,5,,2024,4584,C,,System Programming
What is an editor? Name various types of editors. Explain in detail the main commands of vi-editor.,5,,2024,4585,C,,System Programming
What do you mean by bootstrapping for a compiler? Explain various code optimization techniques.,5,,2024,4586,C,,System Programming
Convert Hexadecimal A2 into Decimal.,20,,2024,4587,A,,Computer Architecture
Explain micro-operations.,20,,2024,4588,A,,Computer Architecture
What is the Auxiliary Carry flag?,20,,2024,4589,A,,Computer Architecture
What is the importance of stack pointer?,20,,2024,4590,A,,Computer Architecture
What is parallel processing?,20,,2024,4591,A,,Computer Architecture
Explain masking of interrupts.,20,,2024,4592,A,,Computer Architecture
Do the operation 10 - 14 using 1’s complement.,20,,2024,4593,A,,Computer Architecture
Differentiate between serial and parallel communication.,20,,2024,4594,A,,Computer Architecture
Explain modular memory.,20,,2024,4595,A,,Computer Architecture
What is the role of virtual memory?,20,,2024,4596,A,,Computer Architecture
Explain Signed Number Multiplication Algorithm with a suitable example.,5,,2024,4597,B,,Computer Architecture
What are the different mapping procedures used in designing Cache Memory?,5,,2024,4598,B,,Computer Architecture
What is the need for Direct Memory Transfer? Explain different types of DMA.,5,,2024,4599,B,,Computer Architecture
Explain the concept of instruction pipelining.,5,,2024,4600,B,,Computer Architecture
Differentiate between Hardwired and Microprogrammed Control Units.,5,,2024,4601,B,,Computer Architecture
Differentiate between RISC and CISC.,5,,2024,4602,C,,Computer Architecture
Explain Programmed I/O and Interrupt-initiated I/O.,5,,2024,4603,C,,Computer Architecture
What is an I/O Processor? Explain its working.,5,,2024,4604,C,,Computer Architecture
Explain Associative Memory. Draw and explain match circuitry logic.,5,,2024,4605,C,,Computer Architecture
Write short notes on any two: (a) Instruction Cycle vs Machine Cycle (b) Static vs Dynamic Memories (c) Advanced concepts of Computer Architecture.,5,,2024,4606,C,,Computer Architecture
Distinguish between DDL and DML.,20,,2024,4607,A,,Relational Database Management System - II
What do you mean by the term Data Independence?,20,,2024,4608,A,,Relational Database Management System - II
Define Primary Key.,20,,2024,4609,A,,Relational Database Management System - II
What are the advantages of E/R model?,20,,2024,4610,A,,Relational Database Management System - II
Discuss the ACID properties of transactions in databases.,20,,2024,4611,A,,Relational Database Management System - II
What is Database failure?,20,,2024,4612,A,,Relational Database Management System - II
What is transaction log? What are its functions?,20,,2024,4613,A,,Relational Database Management System - II
What are the advantages and disadvantages of distributed DBMS?,20,,2024,4614,A,,Relational Database Management System - II
What is a Time Stamp?,20,,2024,4615,A,,Relational Database Management System - II
What is OLAP? Discuss its types.,20,,2024,4616,A,,Relational Database Management System - II
What do you mean by query processing? What are its objectives?,5,,2024,4617,B,,Relational Database Management System - II
What is Normalization and its need? Discuss the Anomalies in 3NF relations.,5,,2024,4618,B,,Relational Database Management System - II
Discuss the advantages and disadvantages of OODBMS.,5,,2024,4619,B,,Relational Database Management System - II
Compare various Database recovery techniques.,5,,2024,4620,B,,Relational Database Management System - II
What is Database Model? Discuss in brief the advantages of relational model.,5,,2024,4621,B,,Relational Database Management System - II
What do you mean by relational algebra? What is its use? Discuss relational operators.,5,,2024,4622,C,,Relational Database Management System - II
Discuss the architecture of Database system.,5,,2024,4623,C,,Relational Database Management System - II
Describe different phases of Data Mining process. Discuss some tools used in data mining.,5,,2024,4624,C,,Relational Database Management System - II
What are Hypercubes?,20,,2024,4625,A,,Data Mining and Data Warehousing
Data Warehouse is an environment and not a product. Explain.,20,,2024,4626,A,,Data Mining and Data Warehousing
What is the significance of metadata in a data warehouse?,20,,2024,4627,A,,Data Mining and Data Warehousing
What is association and correlation?,20,,2024,4628,A,,Data Mining and Data Warehousing
What do you mean by ‘Lazy Learners’?,20,,2024,4629,A,,Data Mining and Data Warehousing
List any four Data Mining applications.,20,,2024,4630,A,,Data Mining and Data Warehousing
What do you mean by back propagation?,20,,2024,4631,A,,Data Mining and Data Warehousing
What is a data mart?,20,,2024,4632,A,,Data Mining and Data Warehousing
What is DBSCAN?,20,,2024,4633,A,,Data Mining and Data Warehousing
Why is data preprocessing needed?,20,,2024,4634,A,,Data Mining and Data Warehousing
What are various ways by which a corporate can provide strategic information for Decision making? Explain each in detail.,5,,2024,4635,B,,Data Mining and Data Warehousing
What is a data warehouse? Explain the three-tier data warehouse architecture.,5,,2024,4636,B,,Data Mining and Data Warehousing
"What are Bayesian classifiers? With an example, describe how to predict a class label using naive Bayesian classification.",5,,2024,4637,B,,Data Mining and Data Warehousing
Discuss various OLAP operations which can be performed on a multidimensional data cube.,5,,2024,4638,B,,Data Mining and Data Warehousing
Explain how decision trees assist in the process of data mining.,5,,2024,4639,B,,Data Mining and Data Warehousing
What are necessary requirements of clustering in data mining? Briefly explain a few well-known Clustering techniques.,5,,2024,4640,C,,Data Mining and Data Warehousing
"What is noisy data? Why is data cleaning required? Explain the binning methods for data cleaning. Also, describe the approaches to fill missing values.",5,,2024,4641,C,,Data Mining and Data Warehousing
"Write short notes on (a) DBMS Schema for Decision Support, (b) Correlation Analysis.",5,,2024,4642,C,,Data Mining and Data Warehousing
Explain the use of const keyword with example.,20,,2024,4643,A,,Object Oriented Programming using C++
Differentiate between nested and container classes.,20,,2024,4644,A,,Object Oriented Programming using C++
What is the use of scope resolution operator.,20,,2024,4645,A,,Object Oriented Programming using C++
Explain the use of this pointer with example.,20,,2024,4646,A,,Object Oriented Programming using C++
What is the use of new and delete operator.,20,,2024,4647,A,,Object Oriented Programming using C++
Explain the difference between early and late binding.,20,,2024,4648,A,,Object Oriented Programming using C++
What is the difference between error and exception.,20,,2024,4649,A,,Object Oriented Programming using C++
Explain the use of friend function.,20,,2024,4650,A,,Object Oriented Programming using C++
What is the use of manipulators.,20,,2024,4651,A,,Object Oriented Programming using C++
What do you mean by dynamic memory management.,20,,2024,4652,A,,Object Oriented Programming using C++
"What are different features of constructor, explain the use of copy constructor with suitable program.",5,,2024,4653,B,,Object Oriented Programming using C++
Write a program to add two complex numbers by overloading + operator.,5,,2024,4654,B,,Object Oriented Programming using C++
Explain the use of pure virtual function with help of program.,5,,2024,4655,B,,Object Oriented Programming using C++
Explain exception handling mechanism.,5,,2024,4656,B,,Object Oriented Programming using C++
"What is the use of templates, explain function template with help of program.",5,,2024,4657,B,,Object Oriented Programming using C++
Write a program to copy contents of one file to another.,5,,2024,4658,C,,Object Oriented Programming using C++
How can you remove ambiguity from hybrid inheritance? Explain with help of program.,5,,2024,4659,C,,Object Oriented Programming using C++
Write a program to find factorial of a number using friend function.,5,,2024,4660,C,,Object Oriented Programming using C++
Define a flip-flop.,20,,2024,4661,A,,Circuits and Logic Design
Convert the following: (46)₁₀ = (?)₈,20,,2024,4662,A,,Circuits and Logic Design
Represent the following signed number using 2's complement method: (−53)₁₀,20,,2024,4663,A,,Circuits and Logic Design
Convert (37)₁₀ into binary form.,20,,2024,4664,A,,Circuits and Logic Design
"Using NOR gate, design an AND gate.",20,,2024,4665,A,,Circuits and Logic Design
What is EEPROM?,20,,2024,4666,A,,Circuits and Logic Design
What is a ring counter?,20,,2024,4667,A,,Circuits and Logic Design
Differentiate between decoder and demultiplexer.,20,,2024,4668,A,,Circuits and Logic Design
Differentiate between combinational and sequential circuits.,20,,2024,4669,A,,Circuits and Logic Design
Explain in brief any three characteristics of TTL family.,20,,2024,4670,A,,Circuits and Logic Design
Design mod-5 synchronous counter using J-K flip-flop.,5,,2024,4671,B,,Circuits and Logic Design
"Simplify the following function using K Map: F(A,B,C) = Σ(0,2,3,4,6)",5,,2024,4672,B,,Circuits and Logic Design
Distinguish between half and full adder using circuit diagram and truth table.,5,,2024,4673,B,,Circuits and Logic Design
Describe the working of MOSFET RAM cell.,5,,2024,4674,B,,Circuits and Logic Design
Explain the following functions in the sum of minterms and product of maxterms: (a) (x + y) (p + q),5,,2024,4675,B,,Circuits and Logic Design
Explain different types of ROM along with their advantages and disadvantages.,5,,2024,4676,C,,Circuits and Logic Design
What is a universal gate? State and prove that NAND and NOR gates are universal gates.,5,,2024,4677,C,,Circuits and Logic Design
a) Implement 16:1 multiplexer using 4:1 multiplexer only and explain its operation. b) Design 1:4 demultiplexer with active high outputs and explain its outputs.,5,,2024,4678,C,,Circuits and Logic Design
How interrupts can be used for IO data transfer?,20,,2024,4679,A,,Computer Peripherals and Interfaces
What is Plug and Play?,20,,2024,4680,A,,Computer Peripherals and Interfaces
What is resource conflict and how it is resolved?,20,,2024,4681,A,,Computer Peripherals and Interfaces
Differentiate between static and dynamic memory?,20,,2024,4682,A,,Computer Peripherals and Interfaces
Why is address bus unidirectional?,20,,2024,4683,A,,Computer Peripherals and Interfaces
Differentiate between serial and parallel data transfer.,20,,2024,4684,A,,Computer Peripherals and Interfaces
What is the need of cache memory?,20,,2024,4685,A,,Computer Peripherals and Interfaces
What is the importance of video RAM?,20,,2024,4686,A,,Computer Peripherals and Interfaces
What are the various IO Data Transfer Modes?,20,,2024,4687,A,,Computer Peripherals and Interfaces
What is the use of TV Tuner Controllers?,20,,2024,4688,A,,Computer Peripherals and Interfaces
What should be the criteria to select a display device for a computer system?,5,,2024,4689,B,,Computer Peripherals and Interfaces
Explain conventional serial and parallel ports.,5,,2024,4690,B,,Computer Peripherals and Interfaces
What are the recent trends in peripheral and bus systems?,5,,2024,4691,B,,Computer Peripherals and Interfaces
Explain EISA. How is it better than ISA?,5,,2024,4692,B,,Computer Peripherals and Interfaces
Differentiate between USB and IEEE1394.,5,,2024,4693,B,,Computer Peripherals and Interfaces
Explain the features of VL (VESA Local) Bus. Compare VESA and PCI.,5,,2024,4694,C,,Computer Peripherals and Interfaces
a) What is DMA? Explain different DMA types. b) What is RAID? Explain different RAID levels.,5,,2024,4695,C,,Computer Peripherals and Interfaces
Write short notes on any two: a) AGP b) Device drivers c) IDE Vs. SCSI,5,,2024,4696,C,,Computer Peripherals and Interfaces
List out the areas in which data structures are applied extensively.,20,,2024,4697,A,,Data Structures
Define the asymptotic notation.,20,,2024,4698,A,,Data Structures
What is circular queue and its operation?,20,,2024,4699,A,,Data Structures
Can you differentiate stack from array?,20,,2024,4700,A,,Data Structures
What is minimum spanning tree?,20,,2024,4701,A,,Data Structures
Write an algorithm to traverse a linked list.,20,,2024,4702,A,,Data Structures
What is hashing? What are its advantages?,20,,2024,4703,A,,Data Structures
What is the use of Dijkstra’s algorithm?,20,,2024,4704,A,,Data Structures
What is dangling reference?,20,,2024,4705,A,,Data Structures
When does a graph become a tree?,20,,2024,4706,A,,Data Structures
Execute an algorithm to convert an infix expression to a postfix expression for [(A+B)(C+D) - (E/F) + (G+H)/I].,5,,2024,4707,B,,Data Structures
Compare and contrast various sorting techniques with respect to memory space and computing time.,5,,2024,4708,B,,Data Structures
Describe the concept of binary search technique? Is it efficient than sequential search?,5,,2024,4709,B,,Data Structures
"A linear array A is given with lower bound as 1. If address of A[25] is 375 and A[30] is 390, find the address of A[16].",5,,2024,4710,B,,Data Structures
Define AVL tree. Explain the operations on AVL tree with illustrations.,5,,2024,4711,B,,Data Structures
Write an algorithm to insert an element into a stack and a queue. Can stack be used for recursion? Justify your answer.,5,,2024,4712,C,,Data Structures
"Explain insertion, deletion, and replacement of nodes in a heap with suitable example.",5,,2024,4713,C,,Data Structures
Write an algorithm to perform breadth first search (BFS). Compare the BFS and DFS search techniques.,5,,2024,4714,C,,Data Structures
What are vanishing points? Explain.,20,,2024,4715,A,,Computer Graphics
Briefly explain the various elements of a graphics system.,20,,2024,4716,A,,Computer Graphics
Why is Bresenham’s algorithm better than DDA?,20,,2024,4717,A,,Computer Graphics
What do you mean by Scan Conversion?,20,,2024,4718,A,,Computer Graphics
What is the main difference between random and raster scan?,20,,2024,4719,A,,Computer Graphics
What is aspect ratio?,20,,2024,4720,A,,Computer Graphics
What are homogeneous coordinates? How are they useful?,20,,2024,4721,A,,Computer Graphics
What do you mean by window and viewport?,20,,2024,4722,A,,Computer Graphics
List various types of plane projections.,20,,2024,4723,A,,Computer Graphics
What are the various methods for text clipping?,20,,2024,4724,A,,Computer Graphics
Discuss Bresenham’s algorithm for line drawing.,5,,2024,4725,B,,Computer Graphics
"Give 2-D transformation matrix for Translation, Rotation, and Scaling.",5,,2024,4726,B,,Computer Graphics
What is the difference between boundary fill and flood-fill algorithms? Write 8-connected boundary fill algorithm.,5,,2024,4727,B,,Computer Graphics
Explain in detail the working of shadow mask and beam penetration CRT.,5,,2024,4728,B,,Computer Graphics
What are various video display devices? Compare and contrast between the random scan and raster scan systems.,5,,2024,4729,C,,Computer Graphics
"a) Perform transformation of triangle A(1,0), B(0,1), C(1,1) by rotating 45° about origin and translating one unit in x and y. b) Translate by one unit in x and y, then rotate 45° about origin.",5,,2024,4730,C,,Computer Graphics
Discuss Cohen-Sutherland line clipping algorithm with an example.,5,,2024,4731,C,,Computer Graphics
Define 2-D Translation.,20,,2024,4732,A,,Computer Graphics
Define 3-D Rotation about Z-axis.,20,,2024,4733,A,,Computer Graphics
What is Aspect Ratio?,20,,2024,4734,A,,Computer Graphics
Explain functioning of any one input device.,20,,2024,4735,A,,Computer Graphics
Define Convex polygon.,20,,2024,4736,A,,Computer Graphics
What is an 8-connected pixel?,20,,2024,4737,A,,Computer Graphics
Define Fractals.,20,,2024,4738,A,,Computer Graphics
What is Antialiasing?,20,,2024,4739,A,,Computer Graphics
What is the initial value of decision parameter in case of Bresenham’s Circle drawing algorithm?,20,,2024,4740,A,,Computer Graphics
Define Perspective projections and discuss any two anomalies.,5,,2024,4741,B,,Computer Graphics
"Magnify the triangle with vertices A(0,0), B(1,1) and C(4,2) to twice its size while keeping C(4,2) fixed.",5,,2024,4742,B,,Computer Graphics
What do you understand by Raster scan devices? Discuss it with the help of example.,5,,2024,4743,B,,Computer Graphics
Explain Phong shading algorithm.,5,,2024,4744,B,,Computer Graphics
Explain simple seed boundary fill algorithm for four connected pixels.,5,,2024,4745,B,,Computer Graphics
Discuss Sutherland Hodgman clipping algorithm in detail using example.,5,,2024,4746,C,,Computer Graphics
"Explain Bresenham’s line drawing algorithm in detail and draw a line from (6,5) to (14,11) using it.",5,,2024,4747,C,,Computer Graphics
Explain Z Buffer surface elimination algorithm in detail.,5,,2024,4748,C,,Computer Graphics
What are vanishing points? Explain.,20,,2024,4749,A,,Computer Graphics
Briefly explain the various elements of a graphics system.,20,,2024,4750,A,,Computer Graphics
Why is Bresenham’s algorithm better than DDA?,20,,2024,4751,A,,Computer Graphics
What do you mean by Scan Conversion?,20,,2024,4752,A,,Computer Graphics
What is the main difference between random and raster scan?,20,,2024,4753,A,,Computer Graphics
What is aspect ratio?,20,,2024,4754,A,,Computer Graphics
What are homogeneous coordinates? How are they useful?,20,,2024,4755,A,,Computer Graphics
What do you mean by window and viewport?,20,,2024,4756,A,,Computer Graphics
List various types of plane projections.,20,,2024,4757,A,,Computer Graphics
What are the various methods for text clipping?,20,,2024,4758,A,,Computer Graphics
Discuss Bresenham’s algorithm for line drawing.,5,,2024,4759,B,,Computer Graphics
"Give 2-D transformation matrix for Translation, Rotation, and Scaling.",5,,2024,4760,B,,Computer Graphics
What is the difference between boundary fill and flood-fill algorithms? Write 8-connected boundary fill algorithm.,5,,2024,4761,B,,Computer Graphics
Explain in detail the working of shadow mask and beam penetration CRT.,5,,2024,4762,B,,Computer Graphics
What are the anomalies of perspective projections?,5,,2024,4763,B,,Computer Graphics
What are various video display devices? Compare and contrast between the random scan and raster scan systems.,5,,2024,4764,C,,Computer Graphics
"a) Perform transformation of triangle A(1,0), B(0,1), C(1,1) by rotating 45° about origin and translating one unit in x and y. b) Translate by one unit in x and y, then rotate 45° about origin.",5,,2024,4765,C,,Computer Graphics
Discuss Cohen-Sutherland line clipping algorithm with an example.,5,,2024,4766,C,,Computer Graphics
Define Big Oh notation.,20,,2024,4767,A,,Design & Analysis of Algorithms
"What is Algorithm design? Also, write its various types.",20,,2024,4768,A,,Design & Analysis of Algorithms
What do you mean by Dynamic Programming?,20,,2024,4769,A,,Design & Analysis of Algorithms
What is the time complexity of binary search?,20,,2024,4770,A,,Design & Analysis of Algorithms
Is merge sort better than quick sort?,20,,2024,4771,A,,Design & Analysis of Algorithms
How to find the degree of a tree?,20,,2024,4772,A,,Design & Analysis of Algorithms
Give a brief concept of Divide and Conquer.,20,,2024,4773,A,,Design & Analysis of Algorithms
What is backtracking?,20,,2024,4774,A,,Design & Analysis of Algorithms
"What are best, average, and worst cases?",20,,2024,4775,A,,Design & Analysis of Algorithms
Define Knapsack problem.,20,,2024,4776,A,,Design & Analysis of Algorithms
Define Spanning Tree. Explain Prim’s Algorithm in detail.,5,,2024,4777,B,,Design & Analysis of Algorithms
What are Asymptotic Notations? Describe various commonly used Asymptotic Notations with examples.,5,,2024,4778,B,,Design & Analysis of Algorithms
Give a suitable example and explain the Breadth First Search Algorithm.,5,,2024,4779,B,,Design & Analysis of Algorithms
Explain N-Queens Problem.,5,,2024,4780,B,,Design & Analysis of Algorithms
Write a short note on Approximation Algorithms for NP-Complete Problems.,5,,2024,4781,B,,Design & Analysis of Algorithms
Explain the greedy approach. Explain fractional knapsack with an example.,5,,2024,4782,C,,Design & Analysis of Algorithms
Explain Quick Sort Algorithm with an example. Provide a complete complexity analysis.,5,,2024,4783,C,,Design & Analysis of Algorithms
"Explain the basic concepts of P, NP, NP-hard, and NP-Complete problems.",5,,2024,4784,C,,Design & Analysis of Algorithms
What is meant by worst-case analysis?,20,,2024,4785,A,,Design & Analysis of Algorithms
Prove that f(n) = O(n).,20,,2024,4786,A,,Design & Analysis of Algorithms
"Define Big Oh (O), Big Omega (Ω), and Big Theta (Θ) notations.",20,,2024,4787,A,,Design & Analysis of Algorithms
Is Insertion sort better than merge sort?,20,,2024,4788,A,,Design & Analysis of Algorithms
How to find the degree of a tree?,20,,2024,4789,A,,Design & Analysis of Algorithms
Give a brief concept of Divide and Conquer.,20,,2024,4790,A,,Design & Analysis of Algorithms
"Arrange the following growth orders in increasing order: O(n^2), O(n log n), O(2^n), O(n).",20,,2024,4791,A,,Design & Analysis of Algorithms
Explain the role of randomization in designing algorithms.,20,,2024,4792,A,,Design & Analysis of Algorithms
Define Knapsack problem.,20,,2024,4793,A,,Design & Analysis of Algorithms
What is NP-hard?,20,,2024,4794,A,,Design & Analysis of Algorithms
"Define the asymptotic notations used for best, average, and worst-case analysis of algorithms.",5,,2024,4795,B,,Design & Analysis of Algorithms
What do you mean by Dynamic Programming? Find the Longest Common Subsequence for P=<1001011> and Q=<01011011>.,5,,2024,4796,B,,Design & Analysis of Algorithms
Give a suitable example and explain the Depth First Search Algorithm.,5,,2024,4797,B,,Design & Analysis of Algorithms
"Find an optimal parenthesization of a matrix-chain multiplication whose dimensions are {5, 10, 3, 12, 5, 50, 6}.",5,,2024,4798,B,,Design & Analysis of Algorithms
Compare Matrix Multiplication and Strassen’s matrix multiplication. Which is better? Justify.,5,,2024,4799,B,,Design & Analysis of Algorithms
Explain Quick Sort Algorithm with an example. Provide a complete complexity analysis.,5,,2024,4800,C,,Design & Analysis of Algorithms
"Explain the basic concepts of P, NP, NP-hard, and NP-Complete problems.",5,,2024,4801,C,,Design & Analysis of Algorithms
"a) What is the Greedy Method? State and write the algorithm for the Knapsack Problem using the Greedy Method.

b) Consider five items with weights W=<5,4,6,2,1> and values V=<5,2,2,4,5>. The capacity of the knapsack W=12. Find the solution for the Fractional Knapsack.",5,,2024,4802,C,,Design & Analysis of Algorithms
What is a Web Browser?,20,,2024,4803,A,,Web Technologies
Explain the term WWW.,20,,2024,4804,A,,Web Technologies
Which tag is used to define a link?,20,,2024,4805,A,,Web Technologies
What is the full form of HTTP?,20,,2024,4806,A,,Web Technologies
What is CSS?,20,,2024,4807,A,,Web Technologies
What is Internet?,20,,2024,4808,A,,Web Technologies
What is AJAX?,20,,2024,4809,A,,Web Technologies
What is an XML Element?,20,,2024,4810,A,,Web Technologies
What is the purpose of XML DTD?,20,,2024,4811,A,,Web Technologies
What is HTTP request?,20,,2024,4812,A,,Web Technologies
Explain various tools used for Web Site Creation.,5,,2024,4813,B,,Web Technologies
Write a short note on JavaScript DOM.,5,,2024,4814,B,,Web Technologies
What is the difference between method overloading and method overriding?,5,,2024,4815,B,,Web Technologies
How are sessions created in PHP? Explain.,5,,2024,4816,B,,Web Technologies
"Explain in detail about <table> tag, its attributes, and related tags with examples.",5,,2024,4817,B,,Web Technologies
Describe various types of Inheritance with examples.,5,,2024,4818,C,,Web Technologies
How can we create a Database in PHP? Explain with an example.,5,,2024,4819,C,,Web Technologies
"Write a short note on the following:
  a) Internet Addressing
  b) Exception Handling
  c) AJAX Server Script.",5,,2024,4820,C,,Web Technologies
"Differentiate between internet, intranet, and internetworking.",20,,2024,4821,A,,Web Technologies
What are URLs and Web Browsers?,20,,2024,4822,A,,Web Technologies
What do you mean by cookies? Give an example.,20,,2024,4823,A,,Web Technologies
What do you understand by JQuery?,20,,2024,4824,A,,Web Technologies
Explain CSS and XML with CSS.,20,,2024,4825,A,,Web Technologies
What is DNS?,20,,2024,4826,A,,Web Technologies
How can we add graphics to an HTML page?,20,,2024,4827,A,,Web Technologies
Briefly describe XML syntax rules.,20,,2024,4828,A,,Web Technologies
Explain the concept of PHP.,20,,2024,4829,A,,Web Technologies
What is the purpose of AJAX Server script?,20,,2024,4830,A,,Web Technologies
How does XMLHttpRequest interact with the server? Explain with syntax.,5,,2024,4831,B,,Web Technologies
