text,Marks,topic,Year,Question_ID,section,,subject
What is meant by tool length compensation?,20,Tool Length Compensation,2024,2967,A,,
What is meant by floating zero for NC machines?,20,Floating Zero for NC Machines,2024,2968,A,,
Write the benefits of Computer Integrated Manufacturing.,20,Computer Integrated Manufacturing,2024,2969,A,,
What are the characteristics of a B-spline curve?,20,B-spline Curve,2024,2970,A,,
What is meant by hidden line removal?,20,Hidden Line Removal,2024,2971,A,,
Write the benefits of FMS.,20,Flexible Manufacturing Systems,2024,2972,A,,
Explain various input and output devices used in CAD.,5,Input and Output Devices in CAD,2024,2973,B,,
Discuss in detail various geometric modeling techniques.,5,Geometric Modeling Techniques,2024,2974,B,,
What is meant by concatenation of transformation matrices? Explain with a suitable example.,5,Concatenation of Transformation Matrices,2024,2975,B,,
Derive the equation of a Bezier curve having 5 control points.,5,Bezier Curve Equation,2024,2976,B,,
What is adaptive control machining system? Describe two types of adaptive controls used in CNC machines.,5,Adaptive Control Machining System,2024,2977,B,,
What is meant by the term ‘Design Process’? Describe any conventional design process techniques. How can computers play their role in the design process?,5,Design Process,2024,2978,C,,
Explain FMS. Describe various types of flexibilities available in FMS.,5,Flexible Manufacturing Systems,2024,2979,C,,
Describe various types of CNC machines.,5,Types of CNC Machines,2024,2980,C,,
Explain the meaning of an air conditioner having capacity 1.5 TR.,20,Air Conditioner Capacity,2024,2981,A,,
Draw the refrigeration cycle of Carnot Refrigerator on T+S diagram.,20,Carnot Refrigeration Cycle,2024,2982,A,,
How will you relate latent heat with saturated liquid enthalpy and saturated vapour enthalpy at given pressure? Justify.,20,Latent Heat Relation,2024,2983,A,,
Draw compressor-capillary tube characteristics in vapor compression refrigeration system.,20,Compressor-Capillary Tube Characteristics,2024,2984,A,,
How will you designate refrigerant COH?,20,Refrigerant Designation,2024,2985,A,,
How hydrogen take the place of expansion valve in Electrolux Refrigerator?,20,Hydrogen in Refrigeration,2024,2986,A,,
How will you determine specific humidity of saturated air having DBT 21°C using psychrometric chart?,20,Specific Humidity Determination,2024,2987,A,,
Define bye-pass factor of a cooling coil.,20,Bypass Factor,2024,2988,A,,
"If apparatus dew point of a cooling coil and dew point temperature of air are same, then will there be any removal of moisture by the cooling coil from that air? Justify your answer.",20,Moisture Removal in Cooling Coil,2024,2989,A,,
Why DPT and WBT are noted on psychrometric chart by taking RH of given air as 100 percent?,20,Psychrometric Chart,2024,2990,A,,
How does an actual vapour compression refrigeration cycle differ from that of a theoretical cycle?,5,Vapour Compression Refrigeration Cycle,2024,2991,B,,
"A refrigeration plant for a food store operates as a reversed Carnot cycle. The store is to be maintained at -5°C and the heat transfer from the store to the cycle is at the rate of 5 kW. If heat is transferred from the cycle to the atmosphere at a temperature of 25°C, calculate the power required to drive the plant.",5,Carnot Cycle Refrigeration Plant,2024,2992,B,,
Draw a neat diagram of lithium bromide water based vapour absorption refrigeration system and explain its working in major fields of applications of this system.,5,Lithium Bromide Vapour Absorption,2024,2993,B,,
Moist air at standard atmospheric pressure enters a cooling coil at 30°C DBT & 50% RH and exits at 15°C DBT & 80% RH. Show the process on a psychrometric chart. Determine the amount of heat and moisture removed per kg of dry air.,5,Cooling Coil Process,2024,2994,B,,
Name the expansion device which controls the degree of superheat of suction vapours in vapour compression refrigeration system. Also explain the construction and working of this expansion device.,5,Expansion Device in Refrigeration,2024,2995,B,,
"Carry out the performance analysis, using schematic flow arrangement and p-h diagram for compound compression (three stage) with multiple expansion valves in series and intercooling, in single load system of vapour compression refrigeration system.",5,Performance Analysis of Compound Compression,2024,2996,C,,
"Outside air at 40°C DBT and 27°C WBT is cooled by a coil with an ADP of 13°C and bypass factor of 0.3. Then the air is passed through a chemical dehumidifier and later through a cooling coil which is maintained at 15°C with a bypass factor of 0.25. The air is then supplied to the air conditioned room. Find the condition of air entering the room. If the circulation of outdoor air in the system is 200m3/min, then find the capacities of the different units used in the system.",5,Air Conditioning System Analysis,2024,2997,C,,
What are different heat sources of latent and sensible heat gain? How will you determine the contribution of these heat sources in order to decide the sensible heat ratio (SHR) for air conditioning a large building?,5,Heat Sources in Air Conditioning,2024,2998,C,,
Name any two limitations of conventional machining processes.,20,Limitations of Conventional Machining,2024,2999,A,,
Define FMS system.,20,FMS System Definition,2024,3000,A,,
Name any two advantages of Non Conventional Machining Processes.,20,Advantages of Non-Conventional Machining,2024,3001,A,,
Name different mechanical type Non Conventional Machining Processes.,20,Mechanical Non-Conventional Machining,2024,3002,A,,
Give two applications of Advanced Mechanical Processes.,20,Applications of Advanced Mechanical Processes,2024,3003,A,,
Name any two Electrochemical and Chemical removal processes.,20,Electrochemical and Chemical Removal,2024,3004,A,,
Give the classification of Thermal Metal Removal Processes.,20,Thermal Metal Removal Processes,2024,3005,A,,
What do you understand by difficult to machine metals?,20,Difficult to Machine Metals,2024,3006,A,,
Which process will you recommend for making a hole of 0.5mm in 10mm thick plate?,20,Hole Making Process,2024,3007,A,,
What do you understand by Hybrid Machining Process?,20,Hybrid Machining Process,2024,3008,A,,
"Explain briefly the latest trends in manufacturing, especially in the automobile sector.",5,Latest Trends in Manufacturing,2024,3009,B,,
"By drawing a neat sketch, explain the Ultrasonic Machining Process with its applications and limitations.",5,Ultrasonic Machining,2024,3010,B,,
"What do you understand by Water Jet Machining? By giving a neat sketch, explain its principle and limitations.",5,Water Jet Machining,2024,3011,B,,
"By using a neat sketch, explain briefly the electro discharge process. Also explain the metal removal process of EDM.",5,Electro Discharge Machining (EDM),2024,3012,B,,
What is plasma arc machining process? Explain by drawing a neat sketch. Explain its applications and limitations also.,5,Plasma Arc Machining,2024,3013,B,,
"Explain briefly the Laser Beam Machining process along with its principle, applications and limitations by using neat sketch.",5,Laser Beam Machining,2024,3014,C,,
"By using neat sketch, explain the working principal of Laser Beam Machining with its applications and limitations.",5,Working of Laser Beam Machining,2024,3015,C,,
Explain any two of the following briefly: (a) Advantages and limitations of Hybrid Machining Processes (b) Abrasive Water Jet Machining Process (c) Electrolytes used in EDM Process.,5,Hybrid Machining and EDM Electrolytes,2024,3016,C,,
Write the elements of transmission drive.,20,Elements of Transmission Drive,2024,3017,A,,
Compare flexible and positive drive.,20,Flexible vs Positive Drive,2024,3018,A,,
Where do you use bevel gears?,20,Bevel Gears Usage,2024,3019,A,,
Write the different types of failure in gear teeth.,20,Gear Teeth Failure,2024,3020,A,,
Why slip is less in case of V-belts when compared to flat belts?,20,Slip in V-belts vs Flat Belts,2024,3021,A,,
What is the effect of increasing pressure angle in gears?,20,Effect of Pressure Angle in Gears,2024,3022,A,,
List the advantages and disadvantages of worm gear drive.,20,Worm Gear Drive,2024,3023,A,,
Specify the four types of gearbox.,20,Types of Gearbox,2024,3024,A,,
What are the advantages of disc brakes over drum brakes?,20,Disc vs Drum Brakes,2024,3025,A,,
Describe the working principle of clutch.,20,Clutch Working Principle,2024,3026,A,,
State and explain diagrammatically the mechanism of transmitting power in a flat belt drive.,5,Flat Belt Drive Mechanism,2024,3027,B,,
"A V belt drive section from a 5 KW torque motor, which runs at 1440 rpm to a light duty compressor running at 970 rpm. The compressor runs for 24 hours per day. Space is available for a centre distance of about 500 mm. Assume the pitch diameter of the driving pulley is 150 mm. Find suitable section type.",5,V-Belt Drive Section,2024,3028,B,,
It is required to design a two-stage spur gear reduction unit with 20° full-depth involute teeth. The input shaft rotates at 1440 rpm and receives 10 kW power through a flexible coupling. The speed of an output shaft should be approximately 180 rpm. Draw a suitable layout and find the speed reduction at each stage and the number of teeth in each gear.,5,Two-Stage Spur Gear Reduction,2024,3029,B,,
"Explain with the neat sketch the concept of (a) block brake with short shoe, (b) block brake with long shoe.",5,Block Brake Concept,2024,3030,B,,
"A pair of worm gears is specified with the following details: ratio 1/30, 10/8, calculate (i) the centre distance, (ii) the speed reduction, and (iii) the dimensions of the worm wheel.",5,Worm Gear Specifications,2024,3031,B,,
"Discuss the basic assumptions involved in the force analysis when gears are in mesh. Explain with the neat sketch, how you will calculate normal and radial force.",5,Force Analysis in Gears,2024,3032,C,,
"A multi-disk clutch consists of two steel disks with one bronze disk. The inner and the outer diameters of the contacting surfaces are 200 mm and 250 mm respectively. The coefficient of friction is 0.1 and the maximum pressure between the contacting surfaces is limited to 0.4 N/mm². Assuming uniform wear theory, calculate the required operating force to engage the clutch and the power transmitting capacity at 720 rpm.",5,Multi-Disk Clutch,2024,3033,C,,
"It is required to design a pair of spur gears with 20° full-depth involute teeth based on the Lewis equation. The velocity factor is to be used to account for the dynamic load. The pinion shaft is connected to a 10 kW, 1440 rpm motor. The speed reduction is 4:1. The pinion starting torque is 150% of the rated torque. The gear is made of plain carbon steel 40C8 (with ultimate tensile strength 600 N/mm²). The factor of safety is 1.5. Design the gears, specify their dimensions, and suggest suitable surface hardness for the gears.",5,Design of Spur Gears,2024,3034,C,,
Name different types of shading techniques used in computer graphics.,20,Shading Techniques,2024,3035,A,,
Why a G code is also called preparatory code?,20,G Code,2024,3036,A,,
What is a bilinear surface patch?,20,Bilinear Surface Patch,2024,3037,A,,
What is the need of graphic standards?,20,Graphic Standards,2024,3038,A,,
What are the characteristics of a B-spline curve?,20,B-spline Curve,2024,3039,A,,
What is meant by Modal Codes in part programming? Given examples of any two Modal Codes.,20,Modal Codes,2024,3040,A,,
What are benefits of CIM?,20,Benefits of CIM,2024,3041,A,,
What is Tool Length Compensation? How is it achieved in CNC part programming?,20,Tool Length Compensation,2024,3042,A,,
What are the components of a Flexible Manufacturing System?,20,Flexible Manufacturing System,2024,3043,A,,
What are the functions of a Graphics package?,20,Graphics Package,2024,3044,A,,
Explain various hidden line removal algorithms used in computer graphics.,5,Hidden Line Removal Algorithms,2024,3045,B,,
"What is meant by Canned Cycle? Explain with the help of an example, any Canned Cycle used in CNC part programming?",5,Canned Cycle,2024,3046,B,,
Explain various types of NC machines based on the path control?,5,Types of NC Machines,2024,3047,B,,
Derive the equation of Hermite Cubic B-spline.,5,Hermite Cubic B-spline,2024,3048,B,,
What is meant by FMS? Describe various types of layouts used in FMS.,5,FMS Layouts,2024,3049,B,,
Explain various types of solid modeling techniques.,5,Solid Modeling Techniques,2024,3050,C,,
What is meant by parametric curve? Why are these types of curves preferred in CAD software?,5,Parametric Curve,2024,3051,C,,
"The vertices of a triangle are A(2, -1, 2), B(7, 2, 1) and C(2, 5, 0). This triangle needs to be rotated about the point A in clockwise direction by 30° about the Y axis. Calculate the new position of the triangle using concatenation.",5,Rotation of Triangle,2024,3052,C,,
What is meant by the term ‘Design Process’? Describe any conventional design process technique. How can computers play their role in the design process?,5,Design Process,2024,3053,C,,
Design to minimize material usage.,20,Material Usage,2024,3054,A,,
Design for recyclability.,20,Recyclability,2024,3055,A,,
Design for variety.,20,Design for Variety,2024,3056,A,,
What is the need for industrial design?,20,Industrial Design,2024,3057,A,,
Define material selection in advanced design.,20,Material Selection,2024,3058,A,,
Write a short note on redesign of castings based on line considerations.,20,Redesign of Castings,2024,3059,A,,
What do you mean by integrated environment?,20,Integrated Environment,2024,3060,A,,
Explain general design principles for manufacturability.,20,Design for Manufacturability,2024,3061,A,,
Explain the importance of component design.,20,Component Design,2024,3062,A,,
Elaborate the term 'Design for the Environment'.,20,Design for the Environment,2024,3063,A,,
Discuss the concept of design to minimize material usage in detail.,5,Material Usage,2024,3064,B,,
Discuss the importance of industrial design and its impact on mechanical systems.,5,Industrial Design,2024,3065,B,,
Explain the principles of material selection in advanced design.,5,Material Selection,2024,3066,B,,
What is meant by integrated environment in advanced design? Explain its significance.,5,Integrated Environment,2024,3067,B,,
Discuss the general design principles for manufacturability with examples.,5,Design for Manufacturability,2024,3068,B,,
Discuss the redesign of castings based on line considerations in detail.,5,Redesign of Castings,2024,3069,C,,
Explain the role of component design in advanced mechanical system design.,5,Component Design,2024,3070,C,,
Elaborate on the term 'Design for the Environment' and its significance in the current context.,5,Design for the Environment,2024,3071,C,,
Explain the concept of 'Design for Variety' and how it applies to advanced design.,5,Design for Variety,2024,3072,C,,
Define Metrology.,20,Metrology,2024,3073,A,,
What are photocells?,20,Photocells,2024,3074,A,,
Distinguish between accuracy and precision.,20,Accuracy and Precision,2024,3075,A,,
Differentiate between systematic and random error.,20,Error Types,2024,3076,A,,
Distinguish between major and minor diameter of a screw thread.,20,Screw Thread Dimensions,2024,3077,A,,
What is Hysteresis?,20,Hysteresis,2024,3078,A,,
Distinguish between waviness and roughness.,20,Surface Texture,2024,3079,A,,
What is a strain gauge? Name two strain gauge materials.,20,Strain Gauge,2024,3080,A,,
What is a thermocouple?,20,Thermocouple,2024,3081,A,,
Define transducer.,20,Transducer,2024,3082,A,,
Explain the principle and working of Taylor Hobson Talysurf used for the measurement of surface roughness.,5,Surface Roughness Measurement,2024,3083,B,,
Define a comparator. Explain the difference between comparator and measuring instrument.,5,Comparators,2024,3084,B,,
Draw and explain generalized block diagram of measurement system.,5,Measurement System,2024,3085,B,,
List the advantages of temperature measurement by using the resistance thermometer.,5,Temperature Measurement,2024,3086,B,,
Discuss Metal wire strain gauge and Metal foil strain gauge in detail.,5,Strain Gauges,2024,3087,B,,
Discuss the first order system response for ramp input signals.,5,First Order System,2024,3088,C,,
Discuss the method of measurement of pitch of the screw thread by using the Tool maker’s microscope.,5,Thread Pitch Measurement,2024,3089,C,,
"Explain the construction and working of LVDT and RVDT, Discuss their advantages and disadvantages.",5,LVDT and RVDT,2024,3090,C,,
"Write short notes on (any Two): (a) Mcleod gauge (b) Total radiation pyrometers, (c) Analog to Digital converter.",5,Measurement Devices,2024,3091,C,,
Define Metrology.,20,Metrology,2024,3092,A,,
What are photocells?,20,Photocells,2024,3093,A,,
Distinguish between accuracy and precision.,20,Accuracy and Precision,2024,3094,A,,
Differentiate between systematic and random error.,20,Error Types,2024,3095,A,,
Distinguish between major and minor diameter of a screw thread.,20,Screw Thread Dimensions,2024,3096,A,,
What is Hysteresis?,20,Hysteresis,2024,3097,A,,
Distinguish between waviness and roughness.,20,Surface Texture,2024,3098,A,,
What is a strain gauge? Name two strain gauge materials.,20,Strain Gauge,2024,3099,A,,
What is a thermocouple?,20,Thermocouple,2024,3100,A,,
Define transducer.,20,Transducer,2024,3101,A,,
Explain the principle and working of Taylor Hobson Talysurf used for the measurement of surface roughness.,5,Surface Roughness Measurement,2024,3102,B,,
Define a comparator. Explain the difference between comparator and measuring instrument.,5,Comparators,2024,3103,B,,
Draw and explain generalized block diagram of measurement system.,5,Measurement System,2024,3104,B,,
List the advantages of temperature measurement by using the resistance thermometer.,5,Temperature Measurement,2024,3105,B,,
Discuss Metal wire strain gauge and Metal foil strain gauge in detail.,5,Strain Gauges,2024,3106,B,,
Discuss the first order system response for ramp input signals.,5,First Order System,2024,3107,C,,
Discuss the method of measurement of pitch of the screw thread by using the Tool maker’s microscope.,5,Thread Pitch Measurement,2024,3108,C,,
"Explain the construction and working of LVDT and RVDT, Discuss their advantages and disadvantages.",5,LVDT and RVDT,2024,3109,C,,
"Write short notes on (any Two): (a) Mcleod gauge (b) Total radiation pyrometers, (c) Analog to Digital converter.",5,Measurement Devices,2024,3110,C,,
Define Metrology.,20,Metrology,2024,3111,A,,
What are photocells?,20,Photocells,2024,3112,A,,
Distinguish between accuracy and precision.,20,Accuracy and Precision,2024,3113,A,,
Differentiate between systematic and random error.,20,Error Types,2024,3114,A,,
Distinguish between major and minor diameter of a screw thread.,20,Screw Thread Dimensions,2024,3115,A,,
What is Hysteresis?,20,Hysteresis,2024,3116,A,,
Distinguish between waviness and roughness.,20,Surface Texture,2024,3117,A,,
What is a strain gauge? Name two strain gauge materials.,20,Strain Gauge,2024,3118,A,,
What is a thermocouple?,20,Thermocouple,2024,3119,A,,
Define transducer.,20,Transducer,2024,3120,A,,
Explain the principle and working of Taylor Hobson Talysurf used for the measurement of surface roughness.,5,Surface Roughness Measurement,2024,3121,B,,
Define a comparator. Explain the difference between comparator and measuring instrument.,5,Comparators,2024,3122,B,,
Draw and explain generalized block diagram of measurement system.,5,Measurement System,2024,3123,B,,
List the advantages of temperature measurement by using the resistance thermometer.,5,Temperature Measurement,2024,3124,B,,
Discuss Metal wire strain gauge and Metal foil strain gauge in detail.,5,Strain Gauges,2024,3125,B,,
Discuss the first order system response for ramp input signals.,5,First Order System,2024,3126,C,,
Discuss the method of measurement of pitch of the screw thread by using the Tool maker’s microscope.,5,Thread Pitch Measurement,2024,3127,C,,
"Explain the construction and working of LVDT and RVDT, Discuss their advantages and disadvantages.",5,LVDT and RVDT,2024,3128,C,,
"Write short notes on (any Two): (a) Mcleod gauge (b) Total radiation pyrometers, (c) Analog to Digital converter.",5,Measurement Devices,2024,3129,C,,
Define Metrology.,20,Metrology,2024,3130,A,,
What are photocells?,20,Photocells,2024,3131,A,,
Distinguish between accuracy and precision.,20,Accuracy and Precision,2024,3132,A,,
Differentiate between systematic and random error.,20,Error Types,2024,3133,A,,
Distinguish between major and minor diameter of a screw thread.,20,Screw Thread Dimensions,2024,3134,A,,
What is Hysteresis?,20,Hysteresis,2024,3135,A,,
Distinguish between waviness and roughness.,20,Surface Texture,2024,3136,A,,
What is a strain gauge? Name two strain gauge materials.,20,Strain Gauge,2024,3137,A,,
What is a thermocouple?,20,Thermocouple,2024,3138,A,,
Define transducer.,20,Transducer,2024,3139,A,,
Explain the principle and working of Taylor Hobson Talysurf used for the measurement of surface roughness.,5,Surface Roughness Measurement,2024,3140,B,,
Define a comparator. Explain the difference between comparator and measuring instrument.,5,Comparators,2024,3141,B,,
Draw and explain generalized block diagram of measurement system.,5,Measurement System,2024,3142,B,,
List the advantages of temperature measurement by using the resistance thermometer.,5,Temperature Measurement,2024,3143,B,,
Discuss Metal wire strain gauge and Metal foil strain gauge in detail.,5,Strain Gauges,2024,3144,B,,
Discuss the first order system response for ramp input signals.,5,First Order System,2024,3145,C,,
Discuss the method of measurement of pitch of the screw thread by using the Tool maker’s microscope.,5,Thread Pitch Measurement,2024,3146,C,,
"Explain the construction and working of LVDT and RVDT, Discuss their advantages and disadvantages.",5,LVDT and RVDT,2024,3147,C,,
"Write short notes on (any Two): (a) Mcleod gauge (b) Total radiation pyrometers, (c) Analog to Digital converter.",5,Measurement Devices,2024,3148,C,,
Define Mean and Mode.,20,Mean and Mode,2024,3149,A,,
Write applications of normal distribution.,20,Applications of Normal Distribution,2024,3150,A,,
Give two properties of binomial distribution.,20,Binomial Distribution,2024,3151,A,,
Define error and error analysis.,20,Error and Error Analysis,2024,3152,A,,
What is the difference between forward and backward difference?,20,Forward and Backward Difference,2024,3153,A,,
What is probability distribution?,20,Probability Distribution,2024,3154,A,,
Define large and small sample.,20,Large and Small Sample,2024,3155,A,,
Define Taylor's series.,20,Taylor's Series,2024,3156,A,,
Write Newton divided difference formula.,20,Newton Divided Difference Formula,2024,3157,A,,
Define standard 5-point formula.,20,Standard 5-point Formula,2024,3158,A,,
"By using Bisection formula, find the roots of equation x³ + x² + 3x - 11 = 0.",5,Bisection Method,2024,3159,B,,
"Find value of 'y' at x=7 and x=27, given X=[5, 7], Y=[26, 35].",5,Interpolation,2024,3160,B,,
Explain the types of sampling distributions.,5,Sampling Distributions,2024,3161,B,,
Solve by using Simpson’s 1/3 rule ∫1/(x + 3)dx for x=0 to x=5.,5,Simpson's 1/3 Rule,2024,3162,B,,
"Using Gauss Jordan Method, solve the equations: 3x + 2y - 5z = 12, 2x + 3y + 7z = 21, 5x + 4y - 3z = 8.",5,Gauss Jordan Method,2024,3163,B,,
"Solve the differential equation dy/dx = (5x + y)/(y - 2x), given y(1) = 1, take h=0.1.",5,Differential Equation,2024,3164,C,,
"Using Runge Kutta method, to find an approximate value of 'y' for x = 0.1 and x = 0.2, given y' = (2x + 3y), y(0) = 1.",5,Runge Kutta Method,2024,3165,C,,
Find the eigen value and eigen vector using Power method for matrix A.,5,Power Method,2024,3166,C,,
What is the advantage of frameless chassis?,20,Chassis,2024,3167,A,,
What are the functions of piston rings?,20,Piston Rings,2024,3168,A,,
What is crank case ventilation?,20,Crank Case Ventilation,2024,3169,A,,
What is the function of radiator?,20,Radiator,2024,3170,A,,
Write different types of brakes used.,20,Brakes,2024,3171,A,,
What is the function of MPFI?,20,MPFI,2024,3172,A,,
What is the function of Thermostat in Engine cooling system?,20,Thermostat,2024,3173,A,,
What is the function of overdrive?,20,Overdrive,2024,3174,A,,
State applications for front and rear wheel drive.,20,Front and Rear Wheel Drive,2024,3175,A,,
What is the function of 'Pitman arm' in Steering system?,20,Pitman Arm,2024,3176,A,,
Discuss working of modern engine cooling system with neat sketch.,5,Engine Cooling System,2024,3177,B,,
Explain with the line diagram the working of individual pump and nozzle system. Explain unit injector system.,5,Pump and Nozzle System,2024,3178,B,,
Explain wishbone type suspension system with diagram.,5,Wishbone Suspension,2024,3179,B,,
Explain constant mesh and synchromesh gearbox.,5,Gearbox,2024,3180,B,,
Explain construction and working of differential.,5,Differential,2024,3181,B,,
Explain common rail direct injection system with neat sketch.,5,Common Rail Direct Injection,2024,3182,C,,
"Write the Preventive maintenance, troubleshooting, and rectification of lubrication and braking system.",5,Maintenance and Troubleshooting,2024,3183,C,,
"Explain the construction, principle of working of any one type of Power Steering system used in Automobile.",5,Power Steering System,2024,3184,C,,
What do you mean by one ton of refrigeration?,20,Refrigeration,2024,3185,A,,
Write about function of condenser in VCRS.,20,VCRS Condenser,2024,3186,A,,
What do you mean by compound compression in VCRS?,20,Compound Compression,2024,3187,A,,
